BEGIN_YEARMONTH,BEGIN_DAY,BEGIN_TIME,END_YEARMONTH,END_DAY,END_TIME,EPISODE_ID,EVENT_ID,STATE,STATE_FIPS,YEAR,MONTH_NAME,EVENT_TYPE,CZ_TYPE,CZ_FIPS,CZ_NAME,WFO,BEGIN_DATE_TIME,CZ_TIMEZONE,END_DATE_TIME,INJURIES_DIRECT,INJURIES_INDIRECT,DEATHS_DIRECT,DEATHS_INDIRECT,DAMAGE_PROPERTY,DAMAGE_CROPS,SOURCE,MAGNITUDE,MAGNITUDE_TYPE,FLOOD_CAUSE,CATEGORY,TOR_F_SCALE,TOR_LENGTH,TOR_WIDTH,TOR_OTHER_WFO,TOR_OTHER_CZ_STATE,TOR_OTHER_CZ_FIPS,TOR_OTHER_CZ_NAME,BEGIN_RANGE,BEGIN_AZIMUTH,BEGIN_LOCATION,END_RANGE,END_AZIMUTH,END_LOCATION,BEGIN_LAT,BEGIN_LON,END_LAT,END_LON,EPISODE_NARRATIVE,EVENT_NARRATIVE,DATA_SOURCE
200609,22,1723,200609,22,1726,1221015,5534876,ARKANSAS,5,2006,September,Tornado,C,65,IZARD,LZK,9/22/2006 17:23,CST,9/22/2006 17:26,0,0,0,0,,,NWS STORM SURVEY,,,,,F1,2,40,,,,,5,SE,FRANKLIN,5,SE,FRANKLIN,36.11667,-91.73333,36.13333,-91.68333,,A weak tornado was spawned in eastern Izard County. The tornado tracked from 4.5 miles southeast of Franklin to 3.5 miles south-southeast of Myron. The tornado snapped or uprooted dozens of trees before continuing into Sharp County.,PDS
200609,2,1350,200609,2,1350,1220861,5534779,IOWA,19,2006,September,Tornado,C,69,FRANKLIN,DMX,9/2/2006 13:50,CST,9/2/2006 13:50,0,0,0,0,,1K,BROADCAST MEDIA,,,,,F0,0.2,30,,,,,2,N,DOWS,2,N,DOWS,42.68333,-93.5,42.68333,-93.5,"A cold front advanced into Iowa in advance of a strong upper air low pressure that was over central South Dakota.  Instability was marginal with CAPE values in the 1000 J/kg range and lifted indices in the -2 to -4 C. range.  A weak shear environment was in place with 20 kts or less of shear in the 0-6 km layer.  Much of the CAPE that was available was in the lowest levels of the atmosphere.  Thunderstorms erupted along the initial surface boundary during peak heating.  With LCL in the 600-1000 meter range, combined with the amount of low level CAPE, the thunderstorms produced numerous funnel clouds.  There were three reported touchdowns.  They were actually more of a landspout that a full fledged tornado.  Little damage occurred as they touched down briefly in open farm files.  The thunderstorms also produced some localized very heavy rainfall.  Satellite pictures shows evidence of a strong tropical connection to Hurricane John in the east Pacific.  Local rainfall of 3 to 4.5 inches in about an hour was reported on the west side of the Des Moines metropolitan area.  There were several reports of 1 to 3 inch rainfall along the Interstate 35 corridor.  Some local street flooding was reported through this area.",Brief tornado touchdown in open fields.,PDS
200609,22,1838,200609,22,1846,1221107,5534830,KENTUCKY,21,2006,September,Tornado,C,59,DAVIESS,PAH,9/22/2006 18:38,CST,9/22/2006 18:46,0,0,0,0,75K,,NWS STORM SURVEY,,,,,F1,4,75,,,,,2,WNW,WHITESVILLE,2,WNW,WHITESVILLE,37.7,-86.91667,37.66667,-86.85,,The tornado touched down and lifted several times. The tornado skipped along Kentucky Highway 54 through the town of Whitesville. Several small outbuildings were destroyed. Several telephone poles were snapped off. Generally minor roof damage occurred to several houses. A mobile home and a modular home had extensive roof damage. Peak winds were estimated near 80 MPH.,PDS
200609,22,1527,200609,22,1535,1221108,5534831,KENTUCKY,21,2006,September,Tornado,C,55,CRITTENDEN,PAH,9/22/2006 15:27,CST,9/22/2006 15:35,0,0,0,0,100K,,NWS STORM SURVEY,,,,,F1,5,150,,,,,5,WSW,SHERIDAN,5,WSW,SHERIDAN,37.31667,-88.28333,37.35,-88.2,,"Numerous trees were topped or uprooted. One mobile home that was not tied down was destroyed. Several outbuildings were destroyed. Trees fell on the roofs of several homes. Many homes received minor roof damage. Peak winds were estimated near 100 MPH. This tornado was spawned by the same supercell thunderstorm that earlier produced a tornado in Livingston County, and would later produce another tornado in Webster County.",PDS
200608,24,1540,200608,24,1552,1220202,5533202,SOUTH DAKOTA,46,2006,August,Tornado,C,119,SULLY,ABR,8/24/2006 15:40,CST,8/24/2006 15:52,0,0,0,0,,,NWS STORM SURVEY,,,,,F1,5,600,,,,,5,NE,ONIDA,5,NE,ONIDA,44.75,-100,44.75,-99.88333,,A supercell thunderstorm produced an F1 intensity tornado northeast of Onida. The tornado traveled for 5 miles in Sully county and had a path width of up to 600 yards. The tornado caused significant damage to a farmstead 6 miles east and 4 miles north of Onida. The ground in a harvested sunflower field was heavily scoured. Many large hay bales were scattered about. The tornado finally lifted in an open field 10 miles east northeast to Onida.,PDS
200609,16,1946,200609,16,1948,1221063,5534340,MINNESOTA,27,2006,September,Tornado,C,85,MCLEOD,MPX,9/16/2006 19:46,CST,9/16/2006 19:48,0,0,0,0,,,NWS STORM SURVEY,,,,,F0,1,30,,,,,2,W,BISCAY,2,W,BISCAY,44.83333,-94.31667,44.83333,-94.3,,An NWS damage survey confirmed that a tornado tore through corn and bean fields.  It dissipated about 100 feet west of a rural Biscay church.,PDS
200609,16,1945,200609,16,1948,1221063,5534341,MINNESOTA,27,2006,September,Tornado,C,93,MEEKER,MPX,9/16/2006 19:45,CST,9/16/2006 19:48,0,0,0,0,200K,,NWS STORM SURVEY,,,,,F0,3.5,50,,,,,1,E,DARWIN,1,E,DARWIN,45.1,-94.4,45.13333,-94.36667,,An NWS damage survey confirmed a fast moving tornado that ripped apart several large sheds and outbuildings.  Scattered trees were downed.,PDS
200609,2,1346,200609,2,1346,1220861,5534777,IOWA,19,2006,September,Tornado,C,69,FRANKLIN,DMX,9/2/2006 13:46,CST,9/2/2006 13:46,0,0,0,0,,1K,LAW ENFORCEMENT,,,,,F0,0.2,30,,,,,3,SW,COULTER,3,SW,COULTER,42.7,-93.41667,42.7,-93.41667,"A cold front advanced into Iowa in advance of a strong upper air low pressure that was over central South Dakota.  Instability was marginal with CAPE values in the 1000 J/kg range and lifted indices in the -2 to -4 C. range.  A weak shear environment was in place with 20 kts or less of shear in the 0-6 km layer.  Much of the CAPE that was available was in the lowest levels of the atmosphere.  Thunderstorms erupted along the initial surface boundary during peak heating.  With LCL in the 600-1000 meter range, combined with the amount of low level CAPE, the thunderstorms produced numerous funnel clouds.  There were three reported touchdowns.  They were actually more of a landspout that a full fledged tornado.  Little damage occurred as they touched down briefly in open farm files.  The thunderstorms also produced some localized very heavy rainfall.  Satellite pictures shows evidence of a strong tropical connection to Hurricane John in the east Pacific.  Local rainfall of 3 to 4.5 inches in about an hour was reported on the west side of the Des Moines metropolitan area.  There were several reports of 1 to 3 inch rainfall along the Interstate 35 corridor.  Some local street flooding was reported through this area.",Brief tornado touchdown in open fields.,PDS
200609,28,1734,200609,28,1744,1220807,5534235,MARYLAND,24,2006,September,Tornado,C,3,ANNE ARUNDEL,LWX,9/28/2006 17:34,EST,9/28/2006 17:44,0,0,0,0,6M,,NWS STORM SURVEY,,,,,F1,2,250,,,,,,,SEVERNA PARK,,,SEVERNA PARK,39.06667,-76.55,39.1,-76.56667,"Significant severe thunderstorms occurred on September 28 across the region. A strong cold front moved from the Appalachian Mountains to the Mid Atlantic during the afternoon. The cold front reached to along the Chesapeake Bay around midnight. The most intense thunderstorms occurred along the Interstate 95 corridor, with one confirmed F1 tornado in Anne Arundel County, Maryland. Intense thunderstorm winds also occurred across the tidal waters of the Potomac and Chesapeake.","The National Weather Service conducted a storm survey in Severna Park and Pasadena Maryland, rating the tornado an F1 on the Fujita scale of tornado intensity. It was determined that a the tornado touched down in the area of Severna Park about 6:34 pm, and traveled two miles before lifting in Pasadena around 6:44 pm. At its maximum the storm was 250 yards wide with winds of 90 mph. 34 homes were severely damaged by falling trees with 13 of those homes rendered uninhabitable. Initial minor damage was located near the intersection of Ritchie Highway and McKinsey Avenue. A hardware store had its sign blown down and a small tree was downed near the Severna Park Marketplace Shopping Center. A few trees were also downed immediately behind the shopping center along Leelynn Road. The tornado gathered strength as it progressed through West Ridge and towards Cattail Creek off of the Magothy River. Five large hardwood trees of one to two feet in diameter were uprooted, and several others were snapped off along Whittier Parkway. Two of the large trees had fallen through houses. These trees, as most of the trees were in the survey, were blown down nearly perpendicular to the path of the tornado (knocked down towards the west). The tornado then reached its most intense and widest extent as it passed through the community of Lower Magothy Beach. Many of these trees knocked down in this area were large two foot diameter hardwood trees that were 60 to 80 feet tall. Leaf spatter was noted on the sides of homes and vehicles. Slight siding damage was noted on one home. Many wires and telephone poles were knocked down in this area. The width of the tornado at this point was 250 yards. Damage became much more limited as the tornado continued north across Norwich Road and Inverness Road in Riverdale. By the time the storm crossed the Magothy for the final time and traveled over the community of Beachwood Park, only leaf litter and small downed branches were noted.",PDS
200609,16,1645,200609,16,1646,1221509,5533625,SOUTH DAKOTA,46,2006,September,Tornado,C,67,HUTCHINSON,FSD,9/16/2006 16:45,CST,9/16/2006 16:46,0,0,0,0,,,EMERGENCY MANAGER,,,,,F0,0.1,50,,,,,5,S,PARKSTON,5,S,PARKSTON,43.33333,-97.98333,43.33333,-97.98333,,A brief tornado in an open area caused no reported damage.,PDS
200609,16,1710,200609,16,1711,1221514,5533632,SOUTH DAKOTA,46,2006,September,Tornado,C,111,SANBORN,FSD,9/16/2006 17:10,CST,9/16/2006 17:11,0,0,0,0,,,TRAINED SPOTTER,,,,,F0,0.1,50,,,,,14,NE,WOONSOCKET,14,NE,WOONSOCKET,44.2,-98.06667,44.2,-98.06667,,A brief tornado caused no reported damage.,PDS
200609,28,1640,200609,28,1650,1221636,5534128,VIRGINIA,51,2006,September,Tornado,C,135,NOTTOWAY,AKQ,9/28/2006 16:40,EST,9/28/2006 16:50,0,0,0,0,5K,,NWS STORM SURVEY,,,,,F1,1.5,100,,,,,5,N,BURKEVILLE,5,N,BURKEVILLE,37.33333,-77.98333,37.33333,-77.98333,,F1 tornado tore off numerous tree tops and twisted large branches near South Genito Road and Lakeside Road. This tornado tracked from Nottoway county into Amelia county.,PDS
200609,28,1650,200609,28,1655,1221636,5534129,VIRGINIA,51,2006,September,Tornado,C,7,AMELIA,AKQ,9/28/2006 16:50,EST,9/28/2006 16:55,0,0,0,0,25K,,NWS STORM SURVEY,,,,,F1,2,75,,,,,,,JETERSVILLE,,,JETERSVILLE,37.6,-77.36667,37.6,-77.36667,,F1 tornado knocked down a cement silo and peeled off a sheet metal roof from a barn. The tornado also lifted a farm trailer and threw it about 100 yards. This tornado moved from Nottoway county into Amelia county.,PDS
200606,22,1647,200606,22,1652,1221738,5533843,OHIO,39,2006,June,Tornado,C,157,TUSCARAWAS,PBZ,6/22/2006 16:47,EST,6/22/2006 16:52,0,0,0,0,50K,,NWS STORM SURVEY,,,,,F1,3,50,,,,,2,NW,STRASBURG,2,NW,STRASBURG,40.61667,-81.55,40.63333,-81.51667,,An NWS storm survey found a tornado producing weak F1 damage to trees and out buildings touched down about 2 miles northwest of Strousberg and lifted 2 miles north of Strousberg. The tornado was on the ground for about 3 miles with a width of around 50 yards. This tornado was produced by the same severe thunderstorm that produced tornadoes in both Holmes and Stark counties in Ohio. (See StormData for Northeast Ohio),PDS
200609,16,1556,200609,16,1557,1221490,5533563,SOUTH DAKOTA,46,2006,September,Tornado,C,101,MOODY,FSD,9/16/2006 15:56,CST,9/16/2006 15:57,0,0,0,0,,,NWS STORM SURVEY,,,,,F0,0.6,50,,,,,10,SSW,COLMAN,10,SSW,COLMAN,43.85,-96.9,43.85,-96.88333,,A tornado which caused F1 damage in Minnehaha County then crossed over a small corner of Lake County also moved briefly into Moody County before dissipating. No damage was reported in Moody County.,PDS
200609,23,300,200609,23,300,1221071,5534412,TENNESSEE,47,2006,September,Tornado,C,125,MONTGOMERY,OHX,9/23/2006 3:00,CST,9/23/2006 3:00,0,0,0,0,40K,,NWS STORM SURVEY,,,,,F0,0.2,100,,,,,12,SE,CLARKSVILLE,12,SE,CLARKSVILLE,36.41667,-87.2,36.41667,-87.2,,An F0 tornado with winds about 70 mph snapped and blew down a few trees. A utility pole was snapped. A shed was destroyed at 1990 Old Oak Plains Rd. Trees were down at 1992 and 1989 Oak Plains Rd.,PDS
200609,16,1605,200609,16,1606,1221495,5533568,SOUTH DAKOTA,46,2006,September,Tornado,C,11,BROOKINGS,FSD,9/16/2006 16:05,CST,9/16/2006 16:06,0,0,0,0,,,NWS STORM SURVEY,,,,,F0,0.4,50,,,,,1,E,BROOKINGS,1,E,BROOKINGS,44.31667,-96.76667,44.31667,-96.75,,A brief tornado caused no reported damage.,PDS
200609,16,1612,200609,16,1613,1221497,5533571,SOUTH DAKOTA,46,2006,September,Tornado,C,15,BRULE,FSD,9/16/2006 16:12,CST,9/16/2006 16:13,0,0,0,0,,,LAW ENFORCEMENT,,,,,F0,0.1,50,,,,,2,NNE,KIMBALL,2,NNE,KIMBALL,43.78333,-98.93333,43.78333,-98.93333,,A brief tornado caused no reported damage.,PDS
200609,16,1635,200609,16,1636,1221506,5533582,SOUTH DAKOTA,46,2006,September,Tornado,C,43,DOUGLAS,FSD,9/16/2006 16:35,CST,9/16/2006 16:36,0,0,0,0,,,GENERAL PUBLIC,,,,,F0,0.1,50,,,,,2,SW,DELMONT,2,SW,DELMONT,43.25,-98.2,43.25,-98.2,,A brief tornado caused no reported damage.,PDS
200609,22,1726,200609,22,1735,1221016,5534877,ARKANSAS,5,2006,September,Tornado,C,135,SHARP,LZK,9/22/2006 17:26,CST,9/22/2006 17:35,0,0,0,0,,,NWS STORM SURVEY,,,,,F1,6,50,,,,,6,NNW,EVENING SHADE,6,NNW,EVENING SHADE,36.15,-91.65,36.15,-91.56667,,"A weak tornado moved from eastern Izard County into western Sharp County. The tornado tracked from 5.8 miles north-northwest of Evening Shade to 5 miles south-southeast of Ash Flat. The tornado damaged several homes, with mostly roof damage noted. A mobile home and recreational vehicle were overturned, and another mobile home was partially destroyed. The tornado also snapped or uprooted dozens of trees before dissipating.",PDS
200608,28,1722,200608,28,1726,1219873,5532769,OHIO,39,2006,August,Tornado,C,129,PICKAWAY,ILN,8/28/2006 17:22,EST,8/28/2006 17:26,0,0,0,0,250K,10K,NWS STORM SURVEY,,,,,F0,1.5,50,,,,,6,SSE,CIRCLEVILLE,6,SSE,CIRCLEVILLE,39.51667,-82.9,39.51667,-82.9,,"A tornado touched down along State Route 361, causing damage to three buildings at the Pickaway Machine and Fabricating Company.  Portions of the aluminum roofing and insulation were removed from these three buildings, and deposited throughout the complex and in a cornfield across Route 361.  Corn stalks at six to eight feet in height were knocked over in a 150 foot wide swath across this cornfield, extending for a mile to the northeast to Boggs Road.  Across Boggs Road, minor tree and limb damage occurred, with part of an open air aluminum shed being blown into a nearby tree line.",PDS
200608,7,1649,200608,7,1659,1220242,5532283,KANSAS,20,2006,August,Tornado,C,193,THOMAS,GLD,8/7/2006 16:49,MST,8/7/2006 16:59,4,0,0,0,125K,,AMATEUR RADIO,,,,,F1,5,25,,,,,2,S,COLBY,2,S,COLBY,39.25,-100.43333,39.25,-100.43333,,"A tornado developed approximately 2 miles south of Colby at Interstate 70 and highway 25 and traveled 5 miles to the northwest before dissipating.  The tornado developed near the Oasis Travel Plaza at 649 pm CDT and dissipated at 659 pm CDT over open fields west of town.  The tornado moved northwest at approximately 30 mph.  A damage survey team rated the tornado an F1 on the Fujita Scale.The tornado injured 4 people as a result of flying glass and debris at the nearby Comfort Inn, which  sustained damage with debris piercing the outside walls, while awnings and tables were also damaged.  A 45 foot sign supported by three ""I"" beams was bent over to the ground.  A car dealership reported damage to about 15-20 vehicles with one vehicle a total loss.  Most of the damage was due to debris breaking windows and denting the vehicles.  A semi truck and trailer parked at the gas station and was lifted and pushed into another truck.",PDS
200608,1,1814,200608,1,1819,1220020,5532792,MINNESOTA,27,2006,August,Tornado,C,165,WATONWAN,MPX,8/1/2006 18:14,CST,8/1/2006 18:19,0,0,0,0,2M,,NWS STORM SURVEY,,,,,F3,1.5,440,,,,,6,SW,BUTTERFIELD,6,SW,BUTTERFIELD,43.9,-94.71667,43.88333,-94.66667,,"Initial damage occurred at farmstead just east of the Watonwan/Cottonwood line. Damage included the partial removal of roofs off two large sheds, along with scattered downed trees. The tornado then moved across corn and bean fields. Another farmstead was hit just southwest of the intersection of County Roads 10 and 2.  This was the location of the F3 damage.  A house was leveled, a 60 foot concrete base silo was toppled and rolled. Virtually all barns, sheds and outbuildings were completely destroyed.",PDS
200608,1,1844,200608,1,1847,1220020,5532793,MINNESOTA,27,2006,August,Tornado,C,165,WATONWAN,MPX,8/1/2006 18:44,CST,8/1/2006 18:47,0,0,0,0,500K,,NWS STORM SURVEY,,,,,F1,1,50,,,,,4,S,ST JAMES,4,S,ST JAMES,43.93333,-94.63333,43.93333,-94.6,,"Shortly after another tornado dissipated at 1842 CST four miles south of St. James, another tornado quickly developed about 1/4 mile away.  It moved across corn and bean fields until it struck a farm just southwest of County Roads 110 and 122, where it destroyed machine sheds and removed the roof of the barn. It continued moving northeast before veering to the north, where it dissipated as it hit an abandoned farmhouse.",PDS
200609,16,2008,200609,16,2008,1221716,5533724,NEBRASKA,31,2006,September,Tornado,C,153,SARPY,OAX,9/16/2006 20:08,CST,9/16/2006 20:08,0,0,0,0,,,FIRE DEPT/RESCUE SQUAD,,,,,F0,0.1,75,,,,,2,N,GRETNA,2,N,GRETNA,41.18333,-96.25,41.18333,-96.25,,"A brief touchdown of a weak tornado was observed just north of Gretna.  Initially the tornado was reported near 180th and Harrison Streets, but a NWS storm survey put the touchdown in an open corn field about 2 miles to the southwest, near 204th and Giles.  Besides the broken corn stalks, no other damage was observed.  The Supercell thunderstorm that produced this tornado had a well developed wall cloud and a moderately long-lived funnel cloud that remained above the ground as it traveled over populated neighborhoods of northern Sarpy county and south central Douglas county.  The funnel was observed by numerous people and was caught on film by at least several storm chasers.  Darkness limited visually sharp images, but frequent lightning observed with the storm allowed for the numerous public and other reports of a funnel cloud.",PDS
200609,22,1356,200609,22,1416,1220931,5534549,MISSOURI,29,2006,September,Tornado,C,93,IRON,LSX,9/22/2006 13:56,CST,9/22/2006 14:16,0,0,0,0,,,NWS STORM SURVEY,,,,,F1,12.4,550,,,,,8,WSW,PILOT KNOB,8,WSW,PILOT KNOB,37.58333,-90.8,37.65,-90.58333,,"As the tornado moved into Iron County from Reynolds County, it tracked northeast paralleling Route N for a mile, resulting in a long swath of continuous damage which spanned both sides of the road.  Numerous trees were either uprooted or snapped, 5 homes sustained roof and exterior damage, and a mobile home was flipped on its side.  The damage path was around a third of a mile wide and was rated high end F1.  The tornado then narrowed and moved across the southeast portion of Snow Hollow Lake where trees were snapped and uprooted.  Two homes sustained moderate damage due to the tornado and fallen trees.  The damage path was about 75 yards wide and was rated F1 in intensity.  The tornado continued northeast crossing Highway 21 around a mile north of Pilot Knob.  Several homes on each side of the highway and a day care center on the west side received minor roof damage.  Trees were also snapped and uprooted.  The tornado then crossed Middlebrook Road where one home lost a portion of its roof, a mobile home sustained moderate damage and a machine shed was destroyed.  This damage was rated F1 in intensity and was about 100 yards wide.  The tornado then moved up the ridge line further east snapping a number of trees half way up.  The tornado then crossed Route V around half a mile south of the Iron/St. Francois County line, snapping and topping trees on both sides of the road.  The damage path was about 40 yards wide and was rated F1.  It appears the tornado lifted just south of the Iron/St. Francois County line around a mile northeast of Route V.  No injuries or deaths were reported.",PDS
200609,22,1602,200609,22,1608,1220932,5534550,MISSOURI,29,2006,September,Tornado,C,93,IRON,LSX,9/22/2006 16:02,CST,9/22/2006 16:08,0,0,0,0,,,NWS STORM SURVEY,,,,,F2,4.8,100,,,,,6,W,PILOT KNOB,6,W,PILOT KNOB,37.63333,-90.76667,37.65,-90.66667,,The tornado touched down 6 miles west of Pilot Knob on Route N where it destroyed a mobile home and blew down several trees and numerous tree limbs.  The damage path was about 40 yards wide and was rated F1 in intensity.  The tornado then traveled east towards Snow Hollow Lake.  A ranch home was severely damaged along the north side of the lake.  The tornado then hit several large trees along the east side of the lake.  The damage path was 100 yards wide in this location with F2 intensity.  The tornado continued moving to the east for another mile before lifting and dissipating.  No injuries or deaths were reported.,PDS
200609,22,1430,200609,22,1448,1220933,5534551,MISSOURI,29,2006,September,Tornado,C,123,MADISON,LSX,9/22/2006 14:30,CST,9/22/2006 14:48,1,0,0,0,,,NWS STORM SURVEY,,,,,F2,18,880,,,,,4,E,ROSELLE,4,E,ROSELLE,37.6,-90.46667,37.65,-90.18333,,"The tornado touched down just west of Route K approximately one mile north of Highway 72.  As it traveled east, numerous trees and tree limbs were blown down.  The tornado moved across U.S. Highway 67 about 4 miles northwest of Fredericktown, knocking down additional trees and tree limbs.  The damage path was about 50 yards wide with a damage intensity of F0.  As it approached the Fredericktown Municipal Airport, along Copper Mines Road, it began to produce multiple vortices.  Two tornadic damage tracks were uncovered across a lake west of Highway OO along County Roads 271 and 272.  Over 20 homes, mobile homes and machine sheds sustained varying degrees of damage.  Several witnesses observed twin tornadoes merging into one large tornado over this area.  The width of the damage path of the northern track was approximately 150 yards wide while the southern damage path was about 100 yards wide.  The damage intensity ranged from F1 to F2 in this location.  As the large tornado crossed Highway OO, five homes, four mobile homes and several machine sheds sustained varying degrees of damage.  The damage path was 300 yards wide and high end F1 intensity.  The tornado continued east along County Road 217.  Four homes sustained F1 to F2 damage with debris from two of the homes thrown between 50 to 100 yards to the east.  Also, numerous trees were either snapped or uprooted in this area.  The width of the damage path in this area was about 250 yards.  Further east, two tornadic damage tracks were uncovered about half a mile to a mile north of the intersection of County Roads 215 and 217.  Four homes sustained varying degrees of damage while one mobile home was completely destroyed.  One person was critically injured near the destroyed mobile home.  Debris from the mobile home was tossed over 150 yards to the east.  The width of the northern damage path was about 150 yards, while the width of the southern track was about 50 yards.  The damage was rated high end F1 in this location.  Witnesses observed the twin tornadoes merge again into one large funnel as it crossed a second small lake north of County Road 217.  Four homes and several machine sheds sustained damage.  Also, over a thousand trees around the lake were snapped or uprooted.  The damage path was a quarter of a mile wide in this location and was rated F1 to low end F2.  The tornado continued eastward into northeast Madison County crossing County Road 219 just south of the Madison/St. Francois County line.  Three homes were damaged and three machine sheds were destroyed, as well as thousands of trees snapped or uprooted.  The width of the damage path in this area was half a mile and was rated F2.  The tornado then crossed into extreme southeastern St. Francois County near Martin Road.",PDS
200609,22,1739,200609,22,1745,1221530,5533694,UTAH,49,2006,September,Tornado,C,19,GRAND,GJT,9/22/2006 17:39,MST,9/22/2006 17:45,0,0,0,0,,,PARK/FOREST SERVICE,,,,,F0,0.2,15,,,,,15,WSW,MOAB,15,WSW,MOAB,38.5,-109.8,38.5,-109.8,Two National Park Service employees and a tourist observed and photographed a tornado which traveled across open country and ripped branches off of juniper and pinyon pine trees.,,PDS
