BEGIN_YEARMONTH,BEGIN_DAY,BEGIN_TIME,END_YEARMONTH,END_DAY,END_TIME,EPISODE_ID,EVENT_ID,STATE,STATE_FIPS,YEAR,MONTH_NAME,EVENT_TYPE,CZ_TYPE,CZ_FIPS,CZ_NAME,WFO,BEGIN_DATE_TIME,CZ_TIMEZONE,END_DATE_TIME,INJURIES_DIRECT,INJURIES_INDIRECT,DEATHS_DIRECT,DEATHS_INDIRECT,DAMAGE_PROPERTY,DAMAGE_CROPS,SOURCE,MAGNITUDE,MAGNITUDE_TYPE,FLOOD_CAUSE,CATEGORY,TOR_F_SCALE,TOR_LENGTH,TOR_WIDTH,TOR_OTHER_WFO,TOR_OTHER_CZ_STATE,TOR_OTHER_CZ_FIPS,TOR_OTHER_CZ_NAME,BEGIN_RANGE,BEGIN_AZIMUTH,BEGIN_LOCATION,END_RANGE,END_AZIMUTH,END_LOCATION,BEGIN_LAT,BEGIN_LON,END_LAT,END_LON,EPISODE_NARRATIVE,EVENT_NARRATIVE,DATA_SOURCE
200606,5,1941,200606,5,1946,1213381,5513636,NORTH DAKOTA,38,2006,June,Tornado,C,77,RICHLAND,FGF,6/5/2006 19:41,CST,6/5/2006 19:46,0,0,0,0,,,NWS STORM SURVEY,,,,,F0,2,25,,,,,8,SSW,HANKINSON,8,SSW,HANKINSON,45.96667,-96.96667,45.96667,-96.9,,The tornado tracked through open fields and pastureland.  The tornado occurred near Interstate 29 near the South Dakota border.,PDS
200605,24,1610,200605,24,1611,1210523,5510449,ILLINOIS,17,2006,May,Tornado,C,119,MADISON,LSX,5/24/2006 16:10,CST,5/24/2006 16:11,0,0,0,0,20K,,NEWSPAPER,,,,,F0,0.2,50,,,,,3,ESE,(ALN)STL RGNL ARPT A,3,ESE,(ALN)STL RGNL ARPT A,38.88333,-90,38.88333,-90,,A brief tornado destroyed a 60 foot by 105 foot barn along Buchta Road west of Illinois Route 159. Witnesses reported seeing a funnel about 50 feet in the air coming across the property. The building was lifted completely off the ground and then dropped.,PDS
200605,24,1505,200605,24,1510,1210526,5510452,ILLINOIS,17,2006,May,Tornado,C,135,MONTGOMERY,LSX,5/24/2006 15:05,CST,5/24/2006 15:10,0,0,0,0,100K,,NWS STORM SURVEY,,,,,F1,2.4,150,,,,,5,ENE,FARMERSVILLE,5,ENE,FARMERSVILLE,39.46667,-89.56667,39.43333,-89.53333,,A tornado touched down 4.6 miles east northeast of Farmersville (Montgomery County in St. Louis CWA).  It traveled to the southeast destroying one machine shed and damaging three other machine sheds.  Two barns and two homes sustained damage as well.  Debris from the machine sheds were tossed a quarter of a mile downwind from their initial locations. The tornado then crossed into Christian County (Central Illinois's CWA) south of the intersection of  3050N and the county line.  No injuries were reported.,PDS
200605,10,1440,200605,10,1440,1210278,5505913,MICHIGAN,26,2006,May,Tornado,C,77,KALAMAZOO,GRR,5/10/2006 14:40,EST,5/10/2006 14:40,0,0,0,0,,2K,NWS STORM SURVEY,,,,,F0,0.1,20,,,,,,,SCHOOLCRAFT,,,SCHOOLCRAFT,42.11667,-85.63333,42.11667,-85.63333,,A very brief touchdown of a F0 tornado occurred two miles south southwest of Schoolcraft in an open field.  This was a landspout type of weak tornado which resulted in no injuries and no significant damage.,PDS
200606,2,1320,200606,2,1321,1212626,5512006,ILLINOIS,17,2006,June,Tornado,C,113,MCLEAN,ILX,6/2/2006 13:20,CST,6/2/2006 13:21,0,0,0,0,,,TRAINED SPOTTER,,,,,F0,0.2,30,,,,,5,SE,DANVERS,5,SE,DANVERS,40.48333,-89.1,40.48333,-89.1,,A tornado briefly touched down in a field.  No damage was reported.,PDS
200606,21,1625,200606,21,1630,1213507,5514019,COLORADO,8,2006,June,Tornado,C,103,RIO BLANCO,GJT,6/21/2006 16:25,MST,6/21/2006 16:30,0,0,0,0,35K,,GENERAL PUBLIC,,,,,F1,1,50,,,,,10,W,MEEKER,10,W,MEEKER,40.03333,-108.1,40.03333,-108.1,"A tornado destroyed a carport, a Basque sheepherder's wagon, and snapped several two-foot diameter trees off, as well as a number of smaller trees as it traveled from southwest to northeast across the property of two residences.  A shed received extensive damage after being struck by flying objects. Debris from the property was found several hundred feet from the homes. The roof of a modular home was partially lifted and shingles were ripped from the roof. The tornado also blew apart braced frame walls of a new home under construction.  The tornado then moved across hay and alfalfa fields before lifting.",,PDS
200605,14,1925,200605,14,1925,1210347,5509324,NORTH CAROLINA,37,2006,May,Tornado,C,147,PITT,MHX,5/14/2006 19:25,EST,5/14/2006 19:25,0,0,0,0,,,GENERAL PUBLIC,,,,,F0,0.1,25,,,,,,,BETHEL,,,BETHEL,35.8,-77.38333,35.8,-77.38333,,Public reported brief tornado along Highway 64 near Bethel.,PDS
200605,14,1946,200605,14,1946,1210347,5509325,NORTH CAROLINA,37,2006,May,Tornado,C,117,MARTIN,MHX,5/14/2006 19:46,EST,5/14/2006 19:46,0,0,0,0,,,BROADCAST MEDIA,,,,,F0,0.1,25,,,,,,,ROBERSONVILLE,,,ROBERSONVILLE,35.81667,-77.25,35.81667,-77.25,,Brief tornado reported by the public and relayed by the media.,PDS
200605,5,1932,200605,5,1935,1211656,5509205,TEXAS,48,2006,May,Tornado,C,417,SHACKELFORD,SJT,5/5/2006 19:32,CST,5/5/2006 19:35,0,0,0,0,,,TRAINED SPOTTER,,,,,F1,1.5,75,,,,,20,W,MORAN,20,W,MORAN,,,,,,A tornado uprooted a large mesquite tree and willow tree. The mesquite tree was approximately 4 feet wide at the base.,PDS
200605,14,1606,200605,14,1608,1210347,5509322,NORTH CAROLINA,37,2006,May,Tornado,C,187,WASHINGTON,MHX,5/14/2006 16:06,EST,5/14/2006 16:08,0,0,0,0,10K,,EMERGENCY MANAGER,,,,,F0,1,25,,,,,8,ENE,ROPER,8,ENE,ROPER,35.91667,-76.48333,35.91667,-76.46667,,Several structures including sheds and a mobile home roof were damaged by a weak tornado.,PDS
200606,23,1252,200606,23,1305,1212213,5511751,NORTH DAKOTA,38,2006,June,Tornado,C,79,ROLETTE,BIS,6/23/2006 12:52,CST,6/23/2006 13:05,0,0,0,0,,,LAW ENFORCEMENT,,,,,F0,4,25,,,,,1,S,ROLLA,1,S,ROLLA,48.83333,-99.6,48.85,-99.51667,,"Tornado tracked by Rolette County Sheriff. No structures impacted and no damage. Tornado crossed from Rolette County (NWS Bismarck) into Towner County (NWS Grand Forks). See Tornado entry for Towner County 1305 to 1310 06/23/06 from National Weather Service Grand Forks, North Dakota.",PDS
200605,5,2345,200605,6,5,1212119,5510813,TEXAS,48,2006,May,Tornado,C,309,MCLENNAN,FWD,5/5/2006 23:45,CST,5/6/2006 0:05,0,0,0,0,3M,,NWS STORM SURVEY,,,,,F2,2.6,150,,,,,,,WACO,,,WACO,,,,,,"A tornado was reported on Waco Drive by the media, just north of the damage swath produced by the downburst.  A damage survey conducted by the National Weather Service in Fort Worth found that a tornado formed south of New Road and just west of Spur 298 (Franklin Avenue), or just north of Richland Mall.  The tornado reached its peak intensity of lower F2 and did the most damage just east of Spur 298.  Several commercial buildings had large sections of their roofs and walls damaged.  A Coca-Cola Bottling Plant lost much of its roof and most of its inventory was damaged.  A spokesman for the company stated that the tornado did well over $1 million worth of damage. An owner of an auto repair shop which was badly damaged estimated damages at $600,000.  A horse barn owned by Baylor University was leveled and two horses killed.  Numerous trees were downed and power lines snapped in and east of this area.  The circulation weakened as it approached Interstate 35, and the tornado dissipated approximately three-fourths of a mile east of Interstate 35.   A countywide disaster declaration was issued by the McLennan County judge.",PDS
200606,20,1609,200606,20,1609,1212232,5510822,NEBRASKA,31,2006,June,Tornado,C,161,SHERIDAN,LBF,6/20/2006 16:09,MST,6/20/2006 16:09,0,0,0,0,150K,,NWS STORM SURVEY,,,,,F1,0.1,10,,,,,2,S,RUSHVILLE,2,S,RUSHVILLE,42.7,-102.45,42.7,-102.45,,"An anti-cyclonic left-moving supercell produced a brief, weak tornado that ripped off the roof of a home, destroyed the attached two car garage, moved outbuildings, and destroyed metal cattle shields.  Debris from the destroyed home impacted a large metal machine shed and was scattered along a 1 mile path northeast of the farmstead.  The home was a complete loss as the chimney fell into the house breaking floor joists.",PDS
200605,11,1606,200605,11,1607,1211718,5508549,VIRGINIA,51,2006,May,Tornado,C,109,LOUISA,AKQ,5/11/2006 16:06,EST,5/11/2006 16:07,0,0,0,0,5K,,NWS STORM SURVEY,,,,,F0,0.8,30,,,,,1,SW,FERNCLIFF,1,SW,FERNCLIFF,37.91667,-78.13333,37.93333,-78.15,,"F0 tornado tracked into Louisa county from Fluvanna county. Minor damage to two homes, including broken windows and lost shingles. Trees down.",PDS
200605,11,1755,200605,11,1756,1211718,5508550,VIRGINIA,51,2006,May,Tornado,C,87,HENRICO,AKQ,5/11/2006 17:55,EST,5/11/2006 17:56,0,0,0,0,15K,,NWS STORM SURVEY,,,,,F1,0.3,200,,,,,5,E,VARINA GROVE,5,E,VARINA GROVE,37.45,-77.26667,37.45,-77.26667,,"F1 tornado uprooted large trees, and many trees snapped off in spiral pattern. Roof blown off of boat house about 100 feet, and outhouse destroyed.",PDS
200605,3,1856,200605,3,1901,1211488,5508547,MISSOURI,29,2006,May,Tornado,C,57,DADE,SGF,5/3/2006 18:56,CST,5/3/2006 19:01,0,0,0,0,,,NWS STORM SURVEY,,,,,F0,3,25,,,,,2,SE,EVERTON,2,SE,EVERTON,37.33333,-93.68333,37.3,-93.65,,A National Weather Service storm survey revealed that a weak tornado produced intermittent tree damage across rural sections of southeast Dade County.  The tornado later tracked into western Greene County.,PDS
200605,3,1901,200605,3,1911,1211489,5508548,MISSOURI,29,2006,May,Tornado,C,77,GREENE,SGF,5/3/2006 19:01,CST,5/3/2006 19:11,0,0,0,0,,,NWS STORM SURVEY,,,,,F0,5,25,,,,,3,SW,ASH GROVE,3,SW,ASH GROVE,37.28333,-93.61667,37.23333,-93.55,,This tornado is a continuation of the Dade County tornado.  A National Weather Service storm survey revealed that a weak tornado caused intermittent tree damage across rural sections of western Greene County.,PDS
200606,22,1628,200606,22,1633,1214000,5518346,COLORADO,8,2006,June,Tornado,C,99,PROWERS,PUB,6/22/2006 16:28,MST,6/22/2006 16:33,0,0,0,0,,,TRAINED SPOTTER,,,,,F0,1,100,,,,,16,S,LAMAR,16,S,LAMAR,37.85,-102.61667,37.86667,-102.61667,,A brief tornado caused no known damage.,PDS
200606,13,1255,200606,13,1255,1214330,5516637,OREGON,41,2006,June,Tornado,C,25,HARNEY,BOI,6/13/2006 12:55,MST,6/13/2006 12:55,0,0,0,0,0,0,OTHER FEDERAL AGENCY,,,,,F0,1,10,,,,,16,N,WAGONTIRE,16,N,WAGONTIRE,43.48333,-119.88333,43.48333,-119.88333,Reported by Federal Employee.,,PDS
200606,13,2310,200606,14,2310,1214441,5517620,SOUTH CAROLINA,45,2006,June,Tornado,C,19,CHARLESTON,CHS,6/13/2006 23:10,EST,6/14/2006 23:10,0,0,0,0,5K,,NWS STORM SURVEY,,,,,F0,0.2,100,,,,,,,LINCOLNVILLE,,,LINCOLNVILLE,33.01667,-80.15,33.01667,-80.15,,NWS damage survey determined F0 tornado touched down near the intersection of Pickens and Lincolnville Roads.  Survey determined winds 60 to 70 mph.  Path length of 1/4 mile long with path width of 100 yards.  Tree damage was found along with minor house damage.,PDS
200606,13,2334,200606,13,2334,1214442,5517621,SOUTH CAROLINA,45,2006,June,Tornado,C,15,BERKELEY,CHS,6/13/2006 23:34,EST,6/13/2006 23:34,1,0,0,0,20K,,NWS STORM SURVEY,,,,,F0,0.7,150,,,,,,,CROSS,,,CROSS,33.31667,-80.16667,33.31667,-80.16667,,"NWS damage survey confirms F0 tornado touchdown near the intersection of Mudville Road and Highway 311.  Path was 3/4 mile long and path width was 150 yards wide.  There was tree damage, damage to a house, a shed was destroyed, and damage to a carport.  Injury occured when a large tree limb dropped onto car.  Wind speeds are estimated at 60 to 70 mph.",PDS
200607,17,1550,200607,17,1550,1214609,5517706,IOWA,19,2006,July,Tornado,C,171,TAMA,DMX,7/17/2006 15:50,CST,7/17/2006 15:50,0,0,0,0,1K,2K,BROADCAST MEDIA,,,,,F0,0.2,30,,,,,2,W,TAMA,2,W,TAMA,42.08333,-92.4,42.08333,-92.4,"A very unstable airmass was in place over Iowa during the afternoon of the 17th, though it was also quite capped.  The 700 mb temperature was in the 14 to 15 C. range, making it difficult for thunderstorm activity to initiate.  Plenty of moisture was available with CAPE values in the 6000 to 8000 J/kg range based on the surface, and near 5000 J/kg in the mixed layer.   Lifted indices fell to near -14 C. by the late afternoon as well.   With the exception of the surface, the lower levels were fairly dry.  The LCL was in excess of 2100 meters by late afternoon. There was plenty of potential for hail with -10 to -30 C layer CAPE in excess of 1000 J/kg, though the freezing level was in excess of 15,500 feet.  Low level lapse rates were in the 8 to 9 C. range in the zero to 3 km layer.  The shear environment was fairly favorable by late afternoon with 30 to 40 kts of effective shear.  A cold front moved southeast across the state during the afternoon.  Ahead of it, a hot and very moist airmass was in place.  Afternoon highs were in the mid 90s to around 100 with dew points in the mid to upper 70s.  Thunderstorms were not able to fire until the late afternoon hours and only over the far eastern part of the CWA.  Once the storms did form, the mode of severe weather was hail.  Hail of golf ball, upwards of 3 inch diameter fell in Black Hawk County at Waterloo.  The hail path began near the airport and then tracked southeast through downtown Waterloo, causing extensive damage.  Tama, Wapello, and Davis Counties were also hit with large hail.  Hail of nearly baseball size pelted the countryside south of Bloomfield.  One brief tornado touched down in Tama County near Tama.  It touched down in an open area just west of town and caused little damage.  During the afternoon  hours, temperatures in Des Moines reached 100 degrees for the first time since August of 2003.  An 83 year old woman was overcome by heat and found dead in her back yard around 1530 in the afternoon.",Tornado touched down briefly in an open area.,PDS
200606,21,1746,200606,21,1756,1214181,5517593,OKLAHOMA,40,2006,June,Tornado,C,139,TEXAS,AMA,6/21/2006 17:46,CST,6/21/2006 17:56,0,0,0,0,700K,,EMERGENCY MANAGER,,,,,F1,2,300,,,,,1,NE,ADAMS,1,NE,ADAMS,36.76667,-101.06667,36.78333,-101.03333,Severe thunderstorms initiated along a surface trough and frontal boundary across the Oklahoma panhandle during the late afternoon hours. The severe thunderstorms produced large hail...damaging winds...and a few landspout tornadoes. One tornado just northeast of Adams caused considerable damage but no injuries were reported.,An official storm damage survey was made by the Texas County Emergency Manager. One hog barn was severely damaged and three homes sustained significant roof damage. Also...two barns and a pickup with a trailor hitched to the pickup were damaged.,PDS
200606,21,1445,200606,21,1450,1214182,5517594,TEXAS,48,2006,June,Tornado,C,117,DEAF SMITH,AMA,6/21/2006 14:45,CST,6/21/2006 14:50,0,0,0,0,,,GENERAL PUBLIC,,,,,F0,0.1,25,,,,,10,NNW,HEREFORD,10,NNW,HEREFORD,36.26667,-101.53333,36.26667,-101.53333,Severe thunderstorms producing large hail...high winds...and several small landspout tornadoes during the late afternoon and into the evening hours initiated along a frontal boundary and surface trough across the Texas panhandle. No damage or injuries were reported.,A very thin landspout tornado based on video footage. No reports of damage or injuries and the path length and path width were estimated. The tornado remained over open country.,PDS
200606,21,1746,200606,21,1748,1213533,5517872,COLORADO,8,2006,June,Tornado,C,125,YUMA,GLD,6/21/2006 17:46,MST,6/21/2006 17:48,0,0,0,0,,,NWS EMPLOYEE(OFF DUTY),,,,,F0,0.3,20,,,,,6,NE,KIRK,6,NE,KIRK,39.68333,-102.51667,39.68333,-102.51667,,Tornado touched down in an open field. No damage was reported.,PDS
200606,24,1614,200606,24,1615,1213550,5518071,WISCONSIN,55,2006,June,Tornado,C,15,CALUMET,GRB,6/24/2006 16:14,CST,6/24/2006 16:15,0,0,0,0,,,EMERGENCY MANAGER,,,,,F0,0.1,10,,,,,4,W,SHERWOOD,4,W,SHERWOOD,44.18333,-88.35,44.18333,-88.35,"Thunderstorms became severe across central and east central Wisconsin from early afternoon to early in the evening ahead of a front that lifted north into the area.  Penny to nickel size hail fell throughout Marathon county.  In Wausau (Marathon co.), penny size hail covered the ground and heavy rain caused some street flooding.  High winds downed trees 10 miles north of Stevens Point (Portage co.), a funnel cloud was spotted at Custer (Portage co.).  A waterspout touched down, and remained nearly stationary, for about a minute in eastern Lake Winnebago (Calumet co.).  A tree that was struck by lightning downed power lines in Scandinavia (Waupaca co.).",,PDS
200606,26,1412,200606,26,1420,1214002,5518353,COLORADO,8,2006,June,Tornado,C,3,ALAMOSA,PUB,6/26/2006 14:12,MST,6/26/2006 14:20,0,0,0,0,,,TRAINED SPOTTER,,,,,F0,2,100,,,,,10,SE,ALAMOSA,10,SE,ALAMOSA,37.36667,-105.75,37.35,-105.73333,,Tornado caused no known damage over open country.  This tornado moved from Alamosa County to Costilla County.,PDS
200606,26,1420,200606,26,1442,1214002,5518354,COLORADO,8,2006,June,Tornado,C,23,COSTILLA,PUB,6/26/2006 14:20,MST,6/26/2006 14:42,0,0,0,0,,,TRAINED SPOTTER,,,,,F0,3,100,,,,,17,SW,FT GARLAND,17,SW,FT GARLAND,37.26667,-105.65,37.16667,-105.56667,,Tornado caused no known damage over open country.,PDS
200606,13,1537,200606,13,1537,1214439,5517618,GEORGIA,13,2006,June,Tornado,C,103,EFFINGHAM,CHS,6/13/2006 15:37,EST,6/13/2006 15:37,0,0,0,0,5K,,EMERGENCY MANAGER,,,,,F0,0.5,50,,,,,3,S,SPRINGFIELD,3,S,SPRINGFIELD,32.31667,-81.31667,32.33333,-81.31667,,Damage survey confirms F0 tornado touchdown 3 miles south of Springfield.  Tornado path was near 0.5 miles long with a width of 50 yards.  Track was near the intersection of Little McCall Road and Courthouse Road.  Tree damage was observed with minor roof damage and damage to a carport.  Winds estimated at 60 to 70 mph.,PDS
200606,13,1330,200606,13,1330,1214440,5517619,SOUTH CAROLINA,45,2006,June,Tornado,C,13,BEAUFORT,CHS,6/13/2006 13:30,EST,6/13/2006 13:30,0,0,0,0,,,EMERGENCY MANAGER,,,,,F0,0.1,10,,,,,,,LAUREL BAY,,,LAUREL BAY,32.5,-80.81667,32.5,-80.81667,,Emergency Manager reports brief touchdown with no damage.,PDS
200606,21,1638,200606,21,1645,1214182,5517645,TEXAS,48,2006,June,Tornado,C,195,HANSFORD,AMA,6/21/2006 16:38,CST,6/21/2006 16:45,0,0,0,0,,,LAW ENFORCEMENT,,,,,F0,0.2,50,,,,,5,W,SPEARMAN,5,W,SPEARMAN,34.81667,-102.4,34.81667,-102.4,Severe thunderstorms producing large hail...high winds...and several small landspout tornadoes during the late afternoon and into the evening hours initiated along a frontal boundary and surface trough across the Texas panhandle. No damage or injuries were reported.,A small landspout tornado was confirmed by photographs. No damage and no injuries were reported. Path length and path width were estimated. The tornado remained over open country.,PDS
200606,21,1810,200606,21,1820,1214182,5517652,TEXAS,48,2006,June,Tornado,C,195,HANSFORD,AMA,6/21/2006 18:10,CST,6/21/2006 18:20,0,0,0,0,,,LAW ENFORCEMENT,,,,,F0,0.2,50,,,,,7,W,GRUVER,7,W,GRUVER,35.1,-101.81667,35.1,-101.81667,Severe thunderstorms producing large hail...high winds...and several small landspout tornadoes during the late afternoon and into the evening hours initiated along a frontal boundary and surface trough across the Texas panhandle. No damage or injuries were reported.,A landspout tornado remained over open country. The path length and path width were estimated. No damage or injuries were reported.,PDS
200606,21,1724,200606,21,1731,1214181,5517591,OKLAHOMA,40,2006,June,Tornado,C,139,TEXAS,AMA,6/21/2006 17:24,CST,6/21/2006 17:31,0,0,0,0,,,BROADCAST MEDIA,,,,,F0,0.2,50,,,,,5,SE,TYRONE,5,SE,TYRONE,36.9,-101,36.9,-101,Severe thunderstorms initiated along a surface trough and frontal boundary across the Oklahoma panhandle during the late afternoon hours. The severe thunderstorms produced large hail...damaging winds...and a few landspout tornadoes. One tornado just northeast of Adams caused considerable damage but no injuries were reported.,Landspout tornado based on video footage with no damage or injuries reported. Path length and path width were estimated. The tornado remained over open country.,PDS
200606,21,1630,200606,21,1635,1214182,5517657,TEXAS,48,2006,June,Tornado,C,195,HANSFORD,AMA,6/21/2006 16:30,CST,6/21/2006 16:35,0,0,0,0,,,BROADCAST MEDIA,,,,,F0,0.2,50,,,,,5,N,GRUVER,5,N,GRUVER,35.98333,-101.75,35.98333,-101.75,Severe thunderstorms producing large hail...high winds...and several small landspout tornadoes during the late afternoon and into the evening hours initiated along a frontal boundary and surface trough across the Texas panhandle. No damage or injuries were reported.,Small landspout tornado reportedly remained over open country. No damage and no injuries were reported. The path length and path width were estimated.,PDS
200606,30,1355,200606,30,1405,1214410,5517430,NEW YORK,36,2006,June,Tornado,C,29,ERIE,BUF,6/30/2006 13:55,EST,6/30/2006 14:05,2,0,0,0,250K,,AMATEUR RADIO,,,,,F1,3,75,,,,,,,CHEEKTOWAGA,,,CHEEKTOWAGA,42.91667,-78.76667,42.91667,-78.76667,"Thunderstorms developed during the afternoon hours as an upper level trough crossed the region. The storms produced hail up to one inch in diameter. Hail reports spanned from Wheatfield across Cheektowaga, Lancaster, Hamburg and Colden to Varysburg. One thunderstorm spawned a tornado which moved across the Town of Cheektowaga. The tornado initially touched down around 2:55 p.m. on Walden Avenue near Harlem Road and traveled from the northwest to the southeast through the town. On Walden Avenue, a construction trailer was moved several hundred feet. The worker in the trailer suffered minor injuries. As the tornado moved across the New York State Thruway, it lifted a tractor trailer and deposited on its side across the Jersey barrier. The driver of the truck suffered a broken leg. The tornado continued on its southeast trek damaging a 20 by 30 foot section of a wall on a warehouse and then downed trees as it crossed through central Cheektowaga. The tornado touched down several times along its path. Its final touchdown was at the Parkside Village Mobile Home Park around 3:05 p.m. where three mobile homes sustained significant damage and eight others sustained minor damage. The tornado was ranked an F1 with a path length of three miles and a width of 75 yards.",,PDS
200606,22,1225,200606,22,1230,1213029,5515005,MISSOURI,29,2006,June,Tornado,C,7,AUDRAIN,LSX,6/22/2006 12:25,CST,6/22/2006 12:30,0,0,0,0,,,NWS STORM SURVEY,,,,,F0,3.5,50,,,,,1,NE,LADDONIA,1,NE,LADDONIA,39.26667,-91.63333,39.26667,-91.58333,,"A severe storm with downburst winds, hail and several tornadoes moved through Audrain County. The last of four tornadoes in Audrain County touched down 1 mile northeast of Laddonia, in an open field.  As it traveled to the northeast it moved into the southwest portions of Farber.  It blew down several large trees and numerous tree limbs in town.  One tree severely damaged the roof of a home in Farber.  The tornado lifted and dissipated about six tenths of a mile northeast of Farber, near U.S. Route 54.   No injuries were reported.",PDS
200606,22,1205,200606,22,1206,1213029,5515002,MISSOURI,29,2006,June,Tornado,C,7,AUDRAIN,LSX,6/22/2006 12:05,CST,6/22/2006 12:06,0,0,0,0,,,NWS STORM SURVEY,,,,,F0,0.1,40,,,,,6,NNW,MEXICO,6,NNW,MEXICO,39.26667,-91.95,39.26667,-91.95,,"A severe storm with downburst winds, hail and several tornadoes moved through Audrain County. The first of four tornadoes in Audrain County briefly touched down 6.4 miles north northwest of Mexico, about three quarters of a mile west of Route 15 and just south of Highway T.  Several large trees were uprooted or snapped off along the tenth of mile damage path. Some of the branches caused minor damage to the roof and side of a home and a machine shed.  No injuries were reported.",PDS
200606,22,1207,200606,22,1209,1213029,5515003,MISSOURI,29,2006,June,Tornado,C,7,AUDRAIN,LSX,6/22/2006 12:07,CST,6/22/2006 12:09,0,0,0,0,,,NWS STORM SURVEY,,,,,F1,1,50,,,,,6,NNW,MEXICO,6,NNW,MEXICO,39.25,-91.93333,39.26667,-91.9,,"A severe storm with downburst winds, hail and several tornadoes moved through Audrain County. The second of four tornadoes in Audrain County briefly touched down 5.6 miles north northwest of Mexico, about half a mile east of Route 15.  A large machine shed was totally destroyed with debris from the shed displaced 300 yards to the east.  Numerous trees were blown down and a home sustained moderate roof damage.  The tornado traveled to the east for about a mile before lifting and dissipating.  No injuries were reported.",PDS
200606,22,1210,200606,22,1211,1213029,5515004,MISSOURI,29,2006,June,Tornado,C,7,AUDRAIN,LSX,6/22/2006 12:10,CST,6/22/2006 12:11,0,0,0,0,,,NWS STORM SURVEY,,,,,F0,0.3,50,,,,,6,N,MEXICO,6,N,MEXICO,39.26667,-91.9,39.26667,-91.9,,"A severe storm with downburst winds, hail and several tornadoes moved through Audrain County. The third of four tornadoes in Audrain County briefly touched down 6.0 miles north of Mexico, about 1.2 miles east of Route 15.  A grain bin was destroyed and several large trees were topped along the quarter of a mile path.  No injuries were reported.",PDS
200606,22,1230,200606,22,1230,1214338,5516866,COLORADO,8,2006,June,Tornado,C,35,DOUGLAS,BOU,6/22/2006 12:30,MST,6/22/2006 12:30,0,0,0,0,0,0,EMERGENCY MANAGER,,,,,F0,0.1,50,,,,,10,SSE,FRANKTOWN,10,SSE,FRANKTOWN,39.25,-104.68333,39.25,-104.68333,,A small tornado touched down but did no damage.,PDS
200606,22,1232,200606,22,1246,1214338,5516867,COLORADO,8,2006,June,Tornado,C,39,ELBERT,BOU,6/22/2006 12:32,MST,6/22/2006 12:46,0,0,0,0,0,0,TRAINED SPOTTER,,,,,F1,0.1,100,,,,,5,SW,ELBERT,5,SW,ELBERT,39.16667,-104.6,39.16667,-104.6,,A tornado touched down a damaged a house under construction.  A large tree was also snapped which damaged another house.,PDS
200606,22,1400,200606,22,1403,1213170,5514526,OHIO,39,2006,June,Tornado,C,107,MERCER,ILN,6/22/2006 14:00,EST,6/22/2006 14:03,0,0,0,0,20K,,NWS STORM SURVEY,,,,,F0,0.2,30,,,,,3,E,ROCKFORD,3,E,ROCKFORD,40.13333,-83.76667,40.13333,-83.76667,,A small tornado briefly touched down near the intersection of US Route 127 and Shelley Road.  A barn was destroyed and a few trees were knocked down.,PDS
200606,22,1430,200606,22,1433,1213170,5514527,OHIO,39,2006,June,Tornado,C,11,AUGLAIZE,ILN,6/22/2006 14:30,EST,6/22/2006 14:33,0,0,0,0,10K,,NWS STORM SURVEY,,,,,F0,0.1,20,,,,,,,WAPAKONETA,,,WAPAKONETA,40.36667,-83.76667,40.36667,-83.76667,,A weak tornado touched down near the intersection of US Route 33 and Interstate 75.  Several homes sustained roof damage from the tornado.,PDS
