BEGIN_YEARMONTH,BEGIN_DAY,BEGIN_TIME,END_YEARMONTH,END_DAY,END_TIME,EPISODE_ID,EVENT_ID,STATE,STATE_FIPS,YEAR,MONTH_NAME,EVENT_TYPE,CZ_TYPE,CZ_FIPS,CZ_NAME,WFO,BEGIN_DATE_TIME,CZ_TIMEZONE,END_DATE_TIME,INJURIES_DIRECT,INJURIES_INDIRECT,DEATHS_DIRECT,DEATHS_INDIRECT,DAMAGE_PROPERTY,DAMAGE_CROPS,SOURCE,MAGNITUDE,MAGNITUDE_TYPE,FLOOD_CAUSE,CATEGORY,TOR_F_SCALE,TOR_LENGTH,TOR_WIDTH,TOR_OTHER_WFO,TOR_OTHER_CZ_STATE,TOR_OTHER_CZ_FIPS,TOR_OTHER_CZ_NAME,BEGIN_RANGE,BEGIN_AZIMUTH,BEGIN_LOCATION,END_RANGE,END_AZIMUTH,END_LOCATION,BEGIN_LAT,BEGIN_LON,END_LAT,END_LON,EPISODE_NARRATIVE,EVENT_NARRATIVE,DATA_SOURCE
200601,2,1450,200601,2,1505,1203301,5486509,KENTUCKY,21,2006,January,Tornado,C,123,LARUE,LMK,1/2/2006 14:50,EST,1/2/2006 15:05,0,0,0,0,500K,,NWS STORM SURVEY,,,,,F1,6.4,175,,,,,1,WSW,TALLEY,1,WSW,TALLEY,37.45,-85.86667,37.5,-85.76667,"The tornado touched down near Talley in southwest Larue County, and was intermittently on the ground until lifting just east of Tanner. Near Talley, the tornado lifted the roof off a home. A home on Upton-Talley Road had the front porch and much of the roof removed. The tornado also did moderate damage to barns and destroyed several outbuildings, and moved a 2700 pound motorboat a distance of 220 feet. In the Oak Hill area, two barns and some outbuildings were destroyed. Another barn and a home were damaged.",,PDS
200601,2,1522,200601,2,1524,1203302,5486510,KENTUCKY,21,2006,January,Tornado,C,1,ADAIR,LMK,1/2/2006 15:22,EST,1/2/2006 15:24,0,0,0,0,150K,,NWS STORM SURVEY,,,,,F2,0.6,200,,,,,1,ESE,COLUMBIA,1,ESE,COLUMBIA,37.1,-85.28333,37.1,-85.26667,"The first tornado touched down near Columbia. It destroyed a mobile home and removed the roof from a house. Other homes and mobile homes were damaged. The tornado lifted and the parent cell travelled into northeast Adair County. The second tornado touched down in the Pellyton area, about 13 miles to the northeast of the first touchdown. Several homes and barns in the area were damaged before the tornado lifted again.",,PDS
200601,2,1557,200601,2,1559,1203302,5486511,KENTUCKY,21,2006,January,Tornado,C,1,ADAIR,LMK,1/2/2006 15:57,EST,1/2/2006 15:59,0,0,0,0,75K,,NWS STORM SURVEY,,,,,F1,0.5,100,,,,,0,SE,PELLYTON,0,SE,PELLYTON,37.21667,-85.08333,37.21667,-85.08333,"The first tornado touched down near Columbia. It destroyed a mobile home and removed the roof from a house. Other homes and mobile homes were damaged. The tornado lifted and the parent cell travelled into northeast Adair County. The second tornado touched down in the Pellyton area, about 13 miles to the northeast of the first touchdown. Several homes and barns in the area were damaged before the tornado lifted again.",,PDS
200601,2,1443,200601,2,1458,1203303,5486512,KENTUCKY,21,2006,January,Tornado,C,93,HARDIN,LMK,1/2/2006 14:43,EST,1/2/2006 14:58,0,0,0,0,2M,,NWS STORM SURVEY,,,,,F2,8.4,150,,,,,1,W,CECILIA,1,W,CECILIA,37.66667,-85.96667,37.76667,-85.9,"The tornado touched down near Cecilia, blowing the roof off a barn, but only producing shingle damage on nearby residences. It did more damage when it reached St. John Road, where it destroyed a home and some farm buildings. As the tornado continued to the northeast, it produced major roof damage to homes along Rineyville Road. Next, an office building that was under construction was lifted off its foundation. A convenience store was destroyed along U.S. 31W. A few more homes received minor damage before the tornado lifted near Longview.",,PDS
200601,28,1527,200601,28,1529,1203584,5485976,KANSAS,20,2006,January,Tornado,C,27,CLAY,TOP,1/28/2006 15:27,CST,1/28/2006 15:29,0,0,0,0,5K,0,STORM CHASER,,,,,F0,0.8,75,,,,,1,ESE,FACT,1,ESE,FACT,39.55,-97.01667,39.55,-97.01667,,"The tornado formed from a low-topped mini-supercell a half mile east southeast of Fact in Clay County, and travelled northeast for 0.8 miles with a path width of 75 yards before dissipating.  The tornado caused minor damage to trees and several cattle feeders, as well as a small windmill.  It was rated as an F0, and damage was estimated at $5K.",PDS
200601,2,1634,200601,2,1648,1203300,5486508,KENTUCKY,21,2006,January,Tornado,C,137,LINCOLN,LMK,1/2/2006 16:34,EST,1/2/2006 16:48,2,0,0,0,350K,,NWS STORM SURVEY,,,,,F2,8.7,200,,,,,3,S,MC KINNEY,3,S,MC KINNEY,37.4,-84.76667,37.46667,-84.61667,"Two people were injured as an F2 tornado swept through western and central Lincoln County. A man received minor injures when a barn he was in collapsed around him. An elderly woman was hospitalized with a broken collar bone and nose. She had been sucked out of her mobile home by strong winds when she tried to open her front door. In all, eight mobile homes were destroyed, with most of the damage being concentrated south of the McKinney area. At one location, the storm survey team found that the tornado had embedded two by six boards firmly into the ground.",,PDS
200601,28,1553,200601,28,1554,1203584,5485977,KANSAS,20,2006,January,Tornado,C,201,WASHINGTON,TOP,1/28/2006 15:53,CST,1/28/2006 15:54,0,0,0,0,0,0,STORM CHASER,,,,,F0,0.3,50,,,,,4,SSW,BARNES,4,SSW,BARNES,39.66667,-96.9,39.66667,-96.9,,The tornado formed from a low-topped mini-supercell 4 miles SSW of Fact and was on the ground briefly before dissipating 0.5 miles E of Fact.  It caused only tree damage and had a path width of about 50 yards.,PDS
200601,13,1718,200601,13,1719,1202023,5485267,SOUTH CAROLINA,45,2006,January,Tornado,C,63,LEXINGTON,CAE,1/13/2006 17:18,EST,1/13/2006 17:19,0,0,0,0,0,0,BROADCAST MEDIA,,,,,F0,0.1,40,,,,,5,NW,IRMO,5,NW,IRMO,34.13333,-81.23333,34.13333,-81.23333,,A waterspout came onshore near Old Forge Point and took down a few trees before dissipating.,PDS
200601,13,1719,200601,13,1720,1202023,5485268,SOUTH CAROLINA,45,2006,January,Tornado,C,79,RICHLAND,CAE,1/13/2006 17:19,EST,1/13/2006 17:20,0,0,0,0,0,0,GENERAL PUBLIC,,,,,F0,0.1,40,,,,,2,SW,BALLENTINE,2,SW,BALLENTINE,34.1,-81.25,34.1,-81.25,,"A waterspout came onshore near Old Forge Point briefly taking down some trees, then moved across the bay to Marina Road Point and took down a few more trees before dissipating.",PDS
200601,13,2000,200601,13,2001,1202023,5485269,SOUTH CAROLINA,45,2006,January,Tornado,C,9,BAMBERG,CAE,1/13/2006 20:00,EST,1/13/2006 20:01,0,0,0,0,0,0,LAW ENFORCEMENT,,,,,F0,0.1,40,,,,,,,BAMBERG,,,BAMBERG,33.3,-81.03333,33.3,-81.03333,,Sheriff reported a small tornado touched down on Jay Street and took down a grove of trees.,PDS
200601,13,2025,200601,13,2026,1202023,5485270,SOUTH CAROLINA,45,2006,January,Tornado,C,75,ORANGEBURG,CAE,1/13/2006 20:25,EST,1/13/2006 20:26,0,0,0,0,,0,NWS STORM SURVEY,,,,,F0,0.3,50,,,,,2,SSW,CORDOVA,2,SSW,CORDOVA,33.4,-80.95,33.4,-80.95,,An F0 touched down along Calvery Rd. taking out some trees and doing minor damage to an outbuilding.,PDS
200601,13,2102,200601,13,2103,1202023,5485271,SOUTH CAROLINA,45,2006,January,Tornado,C,75,ORANGEBURG,CAE,1/13/2006 21:02,EST,1/13/2006 21:03,0,0,0,0,5K,0,NWS STORM SURVEY,,,,,F0,0.3,50,,,,,5,NW,BOWMAN,5,NW,BOWMAN,33.4,-80.75,33.4,-80.75,,An F0 touched down along SC4108 and took out some trees. Neighbors said it hit around 9pm. The roof of a mobile home was peeled back with minor damage to the sides as well.,PDS
200601,11,1720,200601,11,1725,1203408,5487686,VIRGINIA,51,2006,January,Tornado,C,183,SUSSEX,AKQ,1/11/2006 17:20,EST,1/11/2006 17:25,0,0,0,0,20K,,NWS STORM SURVEY,,,,,F1,3.5,200,,,,,1,NE,BOOKER,1,NE,BOOKER,36.95,-77.26667,36.96667,-77.23333,,F1 tornado caused intermittent minor roof damage to several residences in its path. A trailer was overturned which caused damage to a vehicle next to it. Pine tree limbs of up to a foot in diameter were  snapped off.,PDS
200601,11,1823,200601,11,1825,1203408,5487687,VIRGINIA,51,2006,January,Tornado,C,95,JAMES CITY,AKQ,1/11/2006 18:23,EST,1/11/2006 18:25,2,0,0,0,20K,,NWS STORM SURVEY,,,,,F1,0.8,25,,,,,2,NW,JAMESTOWN,2,NW,JAMESTOWN,37.22,-76.81667,37.22,-76.81667,,F1 tornado caused intermittent damage at the Jamestown Beach Campground and Foxfield subdivision. One trailer and a pop-up camper were destroyed at the campground and caused minor injuries to two occupants. Two townhomes suffered minor roof and siding damage in the subdivision. Many trees were damaged along Jamestown Road.,PDS
200601,2,1522,200601,2,1527,1203299,5486507,KENTUCKY,21,2006,January,Tornado,C,111,JEFFERSON,LMK,1/2/2006 15:22,EST,1/2/2006 15:27,0,0,0,0,250K,,NWS STORM SURVEY,,,,,F1,1.5,34,,,,,1,WSW,ST DENNIS,1,WSW,ST DENNIS,38.21667,-85.83333,38.23333,-85.81667,"A tornado touched down at 322 PM near the corner of Bramers and Campground Road in western Jefferson County. Many homes along the damage path had roof damage. A large, well constructed barn was destroyed. Numerous trees and power lines were downed; one tree was blown on to a house. The local Moose Lodge building had significant damage. The tornado lifted around 327 PM near the intersection of Campground Road and Ralph Avenue.",,PDS
200601,13,2030,200601,13,2033,1202430,5482604,GEORGIA,13,2006,January,Tornado,C,39,CAMDEN,JAX,1/13/2006 20:30,EST,1/13/2006 20:33,0,0,0,0,200K,,NWS STORM SURVEY,,,,,F0,100,0.1,,,,,5,SE,WOODBINE,5,SE,WOODBINE,30.91667,-81.65,30.91667,-81.65,"A weak F0 tornado touched down along I-95 about 5 miles southeast of Woodbine.  Many trees were snapped off in a swath along I-95.  A tractor-trailer was lifted and blown off of the interstate along the southbound lanes.  The driver sustained no reported injuries.  The tractor-trailer was carrying other cars, which were damaged in the accident from colliding with each other.  Another vehicle was hit by a snapped tree.  This driver also sustained no reported injuries.",,PDS
200601,14,139,200601,14,140,1202371,5483256,NORTH CAROLINA,37,2006,January,Tornado,C,79,GREENE,MHX,1/14/2006 1:39,EST,1/14/2006 1:40,0,0,0,0,250K,,EMERGENCY MANAGER,,,,,F1,0.7,75,,,,,4,W,SNOW HILL,4,W,SNOW HILL,35.5,-76,35.5,-76,,"Tornado moved northeast across Highway 33, four miles west of Snowhill, ravaging a turkey farm. Six turkey houses were completely destroyed. Fifteen hundred turkeys were killed.",PDS
200601,14,148,200601,14,150,1202371,5483257,NORTH CAROLINA,37,2006,January,Tornado,C,79,GREENE,MHX,1/14/2006 1:48,EST,1/14/2006 1:50,0,0,0,0,750K,,EMERGENCY MANAGER,,,,,F1,1.5,75,,,,,2,SE,SNOW HILL,2,SE,SNOW HILL,34.88333,-78.05,34.88333,-78.05,,Tornado moved northeast across Highway 58 just southeast of Snowhill. Sixteen structures were damaged. Two structures were completely destroyed. There were no injuries or fatalities.,PDS
200601,14,215,200601,14,216,1203409,5487753,VIRGINIA,51,2006,January,Tornado,C,97,KING AND QUEEN,AKQ,1/14/2006 2:15,EST,1/14/2006 2:16,0,0,0,0,15K,,NWS STORM SURVEY,,,,,F0,0.3,50,,,,,5,SE,MILLERS TAVERN,5,SE,MILLERS TAVERN,37.76667,-76.88333,37.76667,-76.88333,,F0 tornado demolished 2 sheds at residence. Some minor roof damage also occurred. Numerous trees blown down or snapped off.,PDS
200601,13,1001,200601,13,1003,1203738,5487738,ALABAMA,1,2006,January,Tornado,C,35,CONECUH,MOB,1/13/2006 10:01,CST,1/13/2006 10:03,0,0,1,0,500K,,EMERGENCY MANAGER,,,,,F1,1,880,,,,,,,BELLEVILLE,,,BELLEVILLE,31.43333,-87.11667,31.43333,-87.11667,,"An F1 tornado touched down along County Road 15, just south of the town of Belleville.  The tornado tracked north northeast crossing U. S. Highway 84 before dissipating just north of the highway.  Most of the damage was along both sides of U. S. Highway 84.  Three homes were destroyed,  and fifteen other structures  and eight vehicles were damaged.    Numerous power lines and trees were blown town along the track of the tornado.  The Belleville fire department station was destroyed.  Only one cinder block wall was left standing at the station.  One person was killed when a chimney in her home collapsed on top of her.  She had just got into the brick home and was putting her purse down when the chimney fell on top of her.",PDS
200601,13,1041,200601,13,1046,1203740,5487740,FLORIDA,12,2006,January,Tornado,C,91,OKALOOSA,MOB,1/13/2006 10:41,CST,1/13/2006 10:46,13,0,0,0,2M,,EMERGENCY MANAGER,,,,,F0,4,50,,,,,,,BAKER,,,BAKER,30.8,-86.7,30.83333,-86.65,,A weak tornado touched down along State Highway 4 in Baker near the Post Office.  The tornado tracked northeast and tore part of the roof off the Baker School.  The winds from the storm funneled into part of the school and peeled sections of the roof off.  Kids inside quickly got underneath their desks.  Water from the rain fell into the classrooms and caused part of the ceiling to collapse.  Thirteen kids suffered minor injuries.   At least four classrooms at the school were damaged.   The weak tornado continued tracking northeast and damaged several more homes before lifting back into the clouds near Old River Road.,PDS
200601,13,1056,200601,13,1059,1203741,5487741,FLORIDA,12,2006,January,Tornado,C,113,SANTA ROSA,MOB,1/13/2006 10:56,CST,1/13/2006 10:59,0,0,0,0,500K,,EMERGENCY MANAGER,,,,,F1,0.8,75,,,,,4,S,BERRYDALE,4,S,BERRYDALE,30.85,-87.01667,30.85,-87.01667,,"An F1 tornado touched down near the intersection of County Road 178 and State Highway 87.  Several manufactured homes were damaged where the tornado first touched down.  The tornado tracked northeast and crossed Highway 87 and caused only minor damage east of the highway.  Near Highway 87 a home had most of the roof torn off.  The roof of the home had reportedly been damaged, twice, by  high winds associated with hurricanes Ivan and Dennis over the past year and a half.  Both times the roof was repaired.  No injuries were reported.",PDS
200602,16,1954,200602,16,1959,1203635,5486570,INDIANA,18,2006,February,Tornado,C,167,VIGO,IND,2/16/2006 19:54,EST,2/16/2006 19:59,0,0,0,0,1.5M,0,NWS STORM SURVEY,,,,,F1,4.2,100,,,,,4,WSW,(HUF)HULMAN FLD TERE,4,WSW,(HUF)HULMAN FLD TERE,39.43333,-87.36667,39.45,-87.3,"A large squall line containing several bowing segments moved through central Indiana on the evening of 16 February 2006.  What was likely an embedded supercell structure produced an F1 tornado near Terre Haute in Vigo County, with widespread straight line wind damage occurring elsewhere along the line as it moved from west to east.  The Vigo County tornado was the first February tornado in Indiana in almost exactly fourteen years.","A tornado touched down just north of Interstate 70, and west of the Margaret Avenue and Fruitridge Avenue intersection, and traveled northeastward.  Along its path, the tornado severely damaged Union Christian Church at State Road 46 and Hulman Drive, and at least 18 buildings and 6 planes at the Terre Haute International Airport, including the Ivy Tech State College building on the airport campus, where three people were trapped as emergency crews waited for power to be shut off before removing them from the building.A preliminary search indicated that this was the first tornado in Vigo county in just over thirteen years, and the first February tornado in Indiana in fourteen years and one day.",PDS
200601,12,2229,200601,12,2247,1203718,5486928,ARKANSAS,5,2006,January,Tornado,C,149,YELL,LZK,1/12/2006 22:29,CST,1/12/2006 22:47,0,0,0,0,,,NWS STORM SURVEY,,,,,F2,13,75,,,,,5,SW,CHICKALAH,5,SW,CHICKALAH,35.11667,-93.35,35.18333,-93.13333,,"A strong tornado touched down in northern Yell County, about 5 miles southwest of Chickalah.  Estimated winds with the tornado were around 140 mph.  A house was severely damaged.  An abandoned mobile home, used for storage, was badly damaged.  A few chicken houses had major damage, and a number of others had parts of the roofs taken off.  A travel trailer was overturned, with numerous sheds and outbuildings destroyed.  A number of power lines and power poles were blown down.  Hundreds of trees were either snapped off or uprooted.  A mobile home was also destroyed by fire, apparently due to a fallen power line.  The tornado tracked to the east-northeast for about 13 miles before moving into southern Pope County.",PDS
200601,12,2247,200601,12,2248,1203719,5486929,ARKANSAS,5,2006,January,Tornado,C,115,POPE,LZK,1/12/2006 22:47,CST,1/12/2006 22:48,0,0,0,0,,,NWS STORM SURVEY,,,,,F2,1.7,75,,,,,5,S,RUSSELLVILLE,5,S,RUSSELLVILLE,35.2,-93.13333,35.21667,-93.1,,A strong tornado moved out of Yell County and into Pope County about 5.3 miles south of Russellville.  Winds were estimated around 140 mph.  The tornado downed a number of trees and power lines.  Several houses sustained roof damage.  The tornado dissipated roughly 5.5 miles south-southeast of Russellville.,PDS
200603,11,2120,200603,11,2147,1205752,5493738,MISSOURI,29,2006,March,Tornado,C,157,PERRY,PAH,3/11/2006 21:20,CST,3/11/2006 21:47,10,0,2,0,1M,,NWS STORM SURVEY,,,,,F3,7,400,,,,,5,WNW,BREWER,5,WNW,BREWER,37.81667,-90,37.88333,-89.9,,"The tornado entered Perry County from Ste. Genevieve County near Highway NN and just west of the community of Giboney. The tornado moved northeast, crossing Interstate 55 only about one-half mile from the Ste. Genevieve County line. Two fatalities and F3 damage occurred in the vicinity of where the tornado crossed U.S. Route 61. The two fatalities occurred on U.S. 61, where a vehicle was picked up and thrown into a propane tank. The truck in which they were riding was likely picked up, flipped over, and slammed into the ground several times. The coroner stated that the victims died instantly. One of the victims was ejected from the truck, which then struck the top of a large propane tank. Because of the ensuing propane leak, the victim still in the truck could not be removed until the following day, when the propane was off-loaded from the tank. Both of the victims in the vehicle were residents of a mobile home who were trying to flee the tornado. The home from which they fled sustained only minor damage. At least four other people were significantly injured as they were picked up by tornadic winds and hurled 100 yards. Their injuries were compounded by wind-blown debris. Eight victims were admitted to a local hospital to remove debris which penetrated their bodies, and two others were sent to regional hospitals for serious injuries. Three mobile homes were flattened, a brick house had its roof and several walls blown off, and numerous vehicles were tossed around. A total of about a dozen residences were destroyed or severely damaged in Perry County. Perry County was designated a federal disaster area, enabling individual residents to apply for relief. The dashboard camera in a sheriff deputy's patrol car captured the tornado on film as it crossed U.S. 61 at F3 intensity. Peak winds were estimated near 170 MPH.  The tornado crossed into Randolph County, Illinois at Old River, near some railroad tracks about 1.5 miles southeast of St. Marys.",PDS
200603,30,1418,200603,30,1419,1205640,5494214,OKLAHOMA,40,2006,March,Tornado,C,137,STEPHENS,OUN,3/30/2006 14:18,CST,3/30/2006 14:19,0,0,0,0,,,STORM CHASER,,,,,F0,0.5,50,,,,,6,ESE,DUNCAN,6,ESE,DUNCAN,33.91667,-97.45,33.91667,-97.45,,A storm chaser video taped a tornado north of Highway 7 east of Duncan in open country. No known damage.,PDS
200601,2,1645,200601,2,1656,1203974,5492215,GEORGIA,13,2006,January,Tornado,C,121,FULTON,FFC,1/2/2006 16:45,EST,1/2/2006 16:56,0,0,0,0,250K,,NWS STORM SURVEY,,,,,F2,4,440,,,,,1,ENE,PALMETTO,1,ENE,PALMETTO,32.68333,-82.51667,32.68333,-82.51667,,"A damage survey team from the National Weather Service in Peachtree City concluded that an F2 tornado had touched down just east of Palmetto in the far southern portion of Fulton county near the Coweta and Fayette county borders.  The tornado touched down near Interstate-85 and U.S. Highway 29 east of Palmetto and then traveled east into extreme northwest Fayette county.  The tornado was rated an F2 and traveled a path of seven miles, of which approximately four miles occurred within Fulton county.  The maximum path width was 1/4 mile wide.  Roof damage was observed to a number of homes along the path of the tornado.  At least six homes east of Palmetto had sustained major damage with large trees down on the structures.  Additionally, a number of trees were down along the path along with several power lines.  Specifically, the tornado began around 8225 Tatum Road.  Numerous trees were down in this area and several homes had sustained roof damage.  The chimney was destroyed on one home.  The tornado then continued across the intersection of Johnson and Tatum Road to Gullatt Road.  Several homes in this area had sustained roof damage and in fact, one home had completely lost its roof.  Numerous trees were either uprooted or snapped off along the path and several power lines were down as well.  From this point, the tornado traveled toward the intersection of Bohannon and Kirkley Roads.  Damage in this section was less extensive with just minor roof damage and only a few trees uprooted or down in the area.  The tornado then crossed into Fayette county.",PDS
200603,30,1604,200603,30,1606,1206179,5494274,KANSAS,20,2006,March,Tornado,C,131,NEMAHA,TOP,3/30/2006 16:04,CST,3/30/2006 16:06,0,0,0,0,200K,,NWS STORM SURVEY,,,,,F1,2,100,,,,,8,S,SABETHA,8,S,SABETHA,39.75,-95.43333,39.75,-95.43333,,"This F1 tornado touched down 7.5 miles south of Sabetha, damaged one farmstead, then moved east-northeast to the Brown county border, roughly 6 miles south of Sabetha, where it damaged a second farmstead.  Debris from the first homestead was scattered over a mile northeast. Some of the debris was lodged in treetops in a nearby woods. Other wood debris was driven several feet into the ground. The tornado had a path length of about 2 miles in Nemaha County with a path width of about 100 yards.  The tornado then crossed the border into Brown County.  The damage in Nemaha county was estimated at $200,000.  This tornado formed in a bow echo that produced an otherwise wide swath of wind damage.",PDS
200603,30,1606,200603,30,1607,1206179,5494275,KANSAS,20,2006,March,Tornado,C,13,BROWN,TOP,3/30/2006 16:06,CST,3/30/2006 16:07,0,0,0,0,150K,,NWS STORM SURVEY,,,,,F1,1,100,,,,,3,WSW,FAIRVIEW,3,WSW,FAIRVIEW,39.78333,-95.78333,39.81667,-95.78333,,"This F1 tornado crossed into Brown County from Nemaha County about 2.5 miles west-southwest of Fairview, where it damaged one farmstead.  The path width was estimated to be 100 yards with the tornado being on the ground in Brown County for less than 1 mile.  The damage in Brown County was estimated at $150,000.  The tornado formed in a bow echo that produced an otherwise wide swath of wind damage.",PDS
200603,11,1635,200603,11,1658,1206143,5494253,MISSOURI,29,2006,March,Tornado,C,213,TANEY,SGF,3/11/2006 16:35,CST,3/11/2006 16:58,0,0,0,0,,,NWS STORM SURVEY,,,,,F0,8,20,,,,,2,SW,BRANSON,2,SW,BRANSON,36.63333,-93.25,36.71667,-93.15,,"A small tornado caused intermittent weak damage across western Taney County.  The tornado touched down in an area between Branson and Table Rock Lake, and tracked into the community of Merriam Woods.  Only minor damage to trees and power poles were observed.",PDS
200601,13,1345,200601,13,1345,1204105,5492611,ALABAMA,1,2006,January,Tornado,C,67,HENRY,TAE,1/13/2006 13:45,EST,1/13/2006 13:45,0,0,0,0,100K,,EMERGENCY MANAGER,,,,,F0,0.2,50,,,,,,,TUMBLETON,,,TUMBLETON,31.4,-85.26667,31.4,-85.26667,,"A severe thunderstorm spawned a weak tornado which damaged a church parsonage, several barns and farm equipment.  It blew down a road sign and a few trees and power lines near the intersection of County Roads 45 and 13.  Also, five homes were damaged.  Reported by the Henry County EMA.",PDS
200601,13,1300,200601,13,1301,1204106,5492612,ALABAMA,1,2006,January,Tornado,C,45,DALE,TAE,1/13/2006 13:00,EST,1/13/2006 13:01,0,0,0,0,500K,,EMERGENCY MANAGER,,,,,F0,1,50,,,,,,,LEVEL PLAINS XRDS,,,LEVEL PLAINS XRDS,31.3,-85.78333,31.31667,-85.76667,,"A severe thunderstorm spawned a weak tornado which heavily damaged four chicken houses.  It also damaged a rental house on the northeast side of Dale County 1.  Debris was strewn across a field east of Dale County 1.  Power lines were down across U.S. Highway 84.  Residents along Joe Bruer Road, northeast of the chicken houses, reported broken limbs.  Reported by the Dale County EMA.",PDS
