BEGIN_YEARMONTH,BEGIN_DAY,BEGIN_TIME,END_YEARMONTH,END_DAY,END_TIME,EPISODE_ID,EVENT_ID,STATE,STATE_FIPS,YEAR,MONTH_NAME,EVENT_TYPE,CZ_TYPE,CZ_FIPS,CZ_NAME,WFO,BEGIN_DATE_TIME,CZ_TIMEZONE,END_DATE_TIME,INJURIES_DIRECT,INJURIES_INDIRECT,DEATHS_DIRECT,DEATHS_INDIRECT,DAMAGE_PROPERTY,DAMAGE_CROPS,SOURCE,MAGNITUDE,MAGNITUDE_TYPE,FLOOD_CAUSE,CATEGORY,TOR_F_SCALE,TOR_LENGTH,TOR_WIDTH,TOR_OTHER_WFO,TOR_OTHER_CZ_STATE,TOR_OTHER_CZ_FIPS,TOR_OTHER_CZ_NAME,BEGIN_RANGE,BEGIN_AZIMUTH,BEGIN_LOCATION,END_RANGE,END_AZIMUTH,END_LOCATION,BEGIN_LAT,BEGIN_LON,END_LAT,END_LON,EPISODE_NARRATIVE,EVENT_NARRATIVE,DATA_SOURCE
200605,14,1450,200605,14,1452,1209846,5504880,TEXAS,48,2006,May,Tornado,C,491,WILLIAMSON,EWX,5/14/2006 14:50,CST,5/14/2006 14:52,0,0,0,0,,,LAW ENFORCEMENT,,,,,F0,0.2,70,,,,,5,NW,ANDICE,5,NW,ANDICE,,,,,,"A small, short-lived tornado touched down briefly, damaging a home and tearing the roof off a barn.  It them moved into an open field and dissipated.",PDS
200604,7,2055,200604,7,2100,1208054,5499717,MISSISSIPPI,28,2006,April,Tornado,C,133,SUNFLOWER,JAN,4/7/2006 20:55,CST,4/7/2006 21:00,0,0,0,0,25K,,TRAINED SPOTTER,,,,,F0,3,50,,,,,2,NW,INDIANOLA,2,NW,INDIANOLA,33.46667,-90.66667,33.48333,-90.61667,,"This weak tornado was witnessed by trained weather spotters just north of Indianola. The tornado downed a few trees, which were blown across a road, and downed a few power lines. Transformers were witnessed blowing as the power lines went down.",PDS
200604,2,2230,200604,2,2232,1207819,5499885,KENTUCKY,21,2006,April,Tornado,C,141,LOGAN,LMK,4/2/2006 22:30,EST,4/2/2006 22:32,0,0,0,0,,,NWS STORM SURVEY,,,,,F1,2,100,,,,,1,ESE,EDWARDS,1,ESE,EDWARDS,36.96667,-86.91667,36.95,-86.88333,,A weak F1 tornado left an intermittent track across rural Logan County. Maximum wind speeds were estimated at 90 mph.,PDS
200604,13,2057,200604,13,2101,1209185,5502566,ILLINOIS,17,2006,April,Tornado,C,131,MERCER,DVN,4/13/2006 20:57,CST,4/13/2006 21:01,0,0,0,0,50K,,NWS STORM SURVEY,,,,,F1,1.5,100,,,,,1,NW,MANNON,1,NW,MANNON,41.25,-90.96667,41.23333,-90.93333,Tornado developed 1 mile northwest of Mannon at 2057 CST and moved southeast just missing the village and dissipated 0.5 miles east southeast of Mannon at 2101 CST.  A mobile home was destroyed.,Rated F1,PDS
200606,9,1105,200606,9,1107,1210150,5505006,NEVADA,32,2006,June,Tornado,C,11,EUREKA,LKN,6/9/2006 11:05,PST,6/9/2006 11:07,0,0,0,0,,,TRAINED SPOTTER,,,,,F0,0.2,20,,,,,1,W,EUREKA ARPT,1,W,EUREKA ARPT,39.6,-116.01667,39.6,-116.01667,,A rope like tornado was observed and photographed over open country about 1 mile west of the Eureka Airport. No reports of damage were received.,PDS
200604,28,2205,200604,28,2206,1209141,5502168,TEXAS,48,2006,April,Tornado,C,121,DENTON,FWD,4/28/2006 22:05,CST,4/28/2006 22:06,0,0,0,0,,,NEWSPAPER,,,,,F0,0.2,10,,,,,,,PILOT PT,,,PILOT PT,33.4,-96.96667,33.4,-96.96667,,The Pilot Point Fire Department reported a tornado touched down near the intersection of FM 455 and Massey Road.  No damage was reported.,PDS
200604,28,2045,200604,28,2047,1209141,5502170,TEXAS,48,2006,April,Tornado,C,497,WISE,FWD,4/28/2006 20:45,CST,4/28/2006 20:47,0,0,0,0,20K,,NEWSPAPER,,,,,F1,0.4,40,,,,,1,W,AURORA,1,W,AURORA,33.06667,-97.51667,33.06667,-97.51667,,A tornado reportedly touched down along FM 4668 just west of Aurora.  Trained spotters reported damage to a home under construction and to several trees.  Volunteer firefighters also reported seeing debris.,PDS
200604,2,1717,200604,2,1717,1208073,5499738,ILLINOIS,17,2006,April,Tornado,C,21,CHRISTIAN,ILX,4/2/2006 17:17,CST,4/2/2006 17:17,0,0,0,0,,,NWS STORM SURVEY,,,,,F0,0.1,50,,,,,4,NE,TAYLORVILLE,4,NE,TAYLORVILLE,39.58333,-89.25,39.58333,-89.25,,The tornado briefly touched down in a field.  No damage was reported.,PDS
200604,2,1742,200604,2,1743,1208075,5499749,ILLINOIS,17,2006,April,Tornado,C,35,CUMBERLAND,ILX,4/2/2006 17:42,CST,4/2/2006 17:43,0,0,0,0,,,NWS STORM SURVEY,,,,,F0,0.8,100,,,,,,,NEOGA,,,NEOGA,39.31667,-88.45,39.31667,-88.45,,The tornado briefly touched down damaging the roof of a school and blowing down several large trees.,PDS
200604,13,2112,200604,13,2115,1209186,5502567,ILLINOIS,17,2006,April,Tornado,C,131,MERCER,DVN,4/13/2006 21:12,CST,4/13/2006 21:15,0,0,0,0,100K,,NWS STORM SURVEY,,,,,F1,0.8,200,,,,,5,WSW,NORTH HENDERSON,5,WSW,NORTH HENDERSON,41.05,-90.55,41.06667,-90.55,"The location of this tornado is Alexis, Illinois which straddles the county line between Mercer and Warren Counties.Tornado began on the northwest side of Alexis at 2112 CST and moved east across the northern part of the village.  It dissipated on the east side close to the abandoned railroad tracks at 2115 CST.  The damage path is north of First Avenue.  A parsonage on the west side of town had 75 percent of its roof torn off with the roof blown onto the house next door.  Across the north side of town, several sheds were heavily damaged or destroyed with considerable tree damage.  One house had its roof completely torn off with varying roof damage to numerous other houses.  Several utility poles were snapped in half.",Rated high F1,PDS
200604,13,1945,200604,13,1946,1209187,5502568,IOWA,19,2006,April,Tornado,C,103,JOHNSON,DVN,4/13/2006 19:45,CST,4/13/2006 19:46,0,0,0,0,5K,,NWS STORM SURVEY,,,,,F1,0.5,440,,,,,4,SE,LONE TREE,4,SE,LONE TREE,41.43333,-91.38333,41.43333,-91.36667,Tornado developed 4.1 miles southeast of Lone Tree at 1945 CST and moved east southeast for 0.5 miles before crossing into Muscatine County at 1946 CST.  The tornado continued east southeast in Muscatine County before turning left and dissipating southeast of Adams at 2002 CST.  While in Johnson County tree and outbuilding damage was noted.,crossed into Muscatine county,PDS
200604,7,1536,200604,7,1541,1208022,5499448,MISSISSIPPI,28,2006,April,Tornado,C,83,LEFLORE,JAN,4/7/2006 15:36,CST,4/7/2006 15:41,0,0,0,0,,,AIRPLANE PILOT,,,,,F0,3,50,,,,,5,W,MORGAN CITY,5,W,MORGAN CITY,33.38333,-90.45,33.4,-90.38333,"The storm which brought a swath of large hail across the southern half of Leflore County, along with a brief weak tornado, was a supercell thunderstorm. This supercell was the first of several which moved across the same portion of Leflore County during the afternoon and evening of April 7th. This first supercell storm began in southern Chicot County Arkansas and tracked across the Delta into southern Leflore County. This long lived supercell brought a swath of quarter to golf ball sized hail across the entire southern portion of the county before it moved into west-central Carroll County, just east of Greenwood.","This weak tornado was first witnessed by a Columbus Air Force Base helicopter pilot on the ground in an open field just west of Morgan City near the Sunflower-Leflore County lines. Shortly after that, several trained storm spotters saw the tornado on the ground 2 miles northwest of Morgan City. Due to the rural location, access to the area was impossible, thus no damage was found.",PDS
200604,2,1646,200604,2,1648,1208072,5499677,ILLINOIS,17,2006,April,Tornado,C,167,SANGAMON,ILX,4/2/2006 16:46,CST,4/2/2006 16:48,0,0,0,0,,,NWS STORM SURVEY,,,,,F1,0.5,200,,,,,4,SW,LOAMI,4,SW,LOAMI,39.63333,-89.9,39.63333,-89.9,,Tornado briefly touched down and knocked down 12 power poles and several large trees.,PDS
200604,13,1946,200604,13,2002,1209188,5502569,IOWA,19,2006,April,Tornado,C,139,MUSCATINE,DVN,4/13/2006 19:46,CST,4/13/2006 20:02,1,0,1,0,120K,,NWS STORM SURVEY,,,,,F1,8.9,440,,,,,4,SW,NICHOLS,4,SW,NICHOLS,41.43333,-91.38333,41.45,-91.21667,"Tornado developed 4.1 mile southeast of Lone Tree in Johnson County at 1945 CST and moved east southeast entering Muscatine County 4.4 miles southwest of Nichols at 1946 CST.  The tornado continued east southeast crossing highway 70 and crossed near the intersection of Davis Avenue and 210th Street 3 miles south of Nichols.  Here a 49 year old female was killed and her husband injured when their mobile home was destroyed.  The tornado continued east southeast and entered Red Cedar WMA, crossed the Cedar River, and turned northeast.  The tornado crossed the Cedar River a second time, crossed highway 22 and dissipated 1.8 miles southeast of Adams at 2002 CST.Considerable tree and outbuilding damage occurred south of Nichols along with some damage to homes and garages.",Entered from Johnson County,PDS
200604,13,1948,200604,13,1949,1209189,5502570,IOWA,19,2006,April,Tornado,C,103,JOHNSON,DVN,4/13/2006 19:48,CST,4/13/2006 19:49,0,0,0,0,2K,,NWS STORM SURVEY,,,,,F1,0.3,176,,,,,3,E,LONE TREE,3,E,LONE TREE,41.48333,-91.38333,41.48333,-91.36667,"Tornado developed 2.9 miles east of Lone Tree at 1948 CST and moved east southeast 0.3 miles before crossing into Muscatine County at 1949 CST.  Once in Muscatine County, the tornado continued east southeast and moved through the town of Nichols before turning left and dissipated 1 mile northeast of Nichols at 1956 CST.In Johnson County, tree damage was noted with an outbuilding damaged.",Crossed into Muscatine County,PDS
200604,13,1949,200604,13,1956,1209190,5502571,IOWA,19,2006,April,Tornado,C,139,MUSCATINE,DVN,4/13/2006 19:49,CST,4/13/2006 19:56,0,0,0,0,80K,,NWS STORM SURVEY,,,,,F1,4.5,176,,,,,3,W,NICHOLS,3,W,NICHOLS,41.48333,-91.38333,41.5,-91.3,Tornado developed 2.9 miles east of Lone Tree in Johnson County at 1948 CST and crossed into Muscatine County at 1949 CST.  The tornado continued in a just south of east movement and entered the town of Nichols before curving to the north.  The tornado dissipated 1 mile northeast of Nichols at 1956 CST.A community center was unroofed and a new metal pole barn was destroyed.  Tree damage was also noted.,Entered from Johnson County,PDS
200605,5,1700,200605,5,1702,1210329,5505206,TEXAS,48,2006,May,Tornado,C,445,TERRY,LUB,5/5/2006 17:00,CST,5/5/2006 17:02,0,0,0,0,0,0,TRAINED SPOTTER,,,,,F0,0.7,50,,,,,12,NW,BROWNFIELD,12,NW,BROWNFIELD,33.3,-102.43333,33.3,-102.41667,"May 5 Severe Thunderstorm Event Summary...Another outbreak of severe thunderstorms affected parts of the west Texas South Plains region during the afternoon and evening hours of the 5th.  This activity was part of a widespread severe weather event across much of west Texas, including the Permian Basin where at least one significant tornado occurred. Severe convection erupted during the late afternoon hours along a warm front that was oriented west-to-east over the southern portions of the South Plains. These storms quickly evolved into supercells, and produced large hail, damaging winds, and at least four tornadoes. Although the tornadoes remained over open farmland, tornadic winds destroyed to center-pivot irrigation systems northwest of Brownfield (Terry County). This resulted in property losses of half a million dollars.The supercellular convection evolved into a cluster of severe multicell storms by early evening as it continued to propagate eastward along the boundary. A small linear complex characterized by a mini bow-shaped radar echo produced a locally intense downburst near Lake Alan Henry in southeastern Garza County. Winds estimated to exceed 90 MPH destroyed a number of mobile homes and vehicles near the lake, and injured one resident.Total economical losses sustained over the South Plains region during the outbreak were estimated to just under $1 million.","Storm spotters observed the first in a family of three tornadoes northwest of Brownfield at 17:00 CST. The tornado reportedly moved over open farmland for two minutes, and resulted in no damage.",PDS
200605,5,1705,200605,5,1707,1210329,5505207,TEXAS,48,2006,May,Tornado,C,445,TERRY,LUB,5/5/2006 17:05,CST,5/5/2006 17:07,0,0,0,0,0,0,TRAINED SPOTTER,,,,,F0,0.8,70,,,,,11,NNW,BROWNFIELD,11,NNW,BROWNFIELD,33.33333,-102.35,33.31667,-102.35,"May 5 Severe Thunderstorm Event Summary...Another outbreak of severe thunderstorms affected parts of the west Texas South Plains region during the afternoon and evening hours of the 5th.  This activity was part of a widespread severe weather event across much of west Texas, including the Permian Basin where at least one significant tornado occurred. Severe convection erupted during the late afternoon hours along a warm front that was oriented west-to-east over the southern portions of the South Plains. These storms quickly evolved into supercells, and produced large hail, damaging winds, and at least four tornadoes. Although the tornadoes remained over open farmland, tornadic winds destroyed to center-pivot irrigation systems northwest of Brownfield (Terry County). This resulted in property losses of half a million dollars.The supercellular convection evolved into a cluster of severe multicell storms by early evening as it continued to propagate eastward along the boundary. A small linear complex characterized by a mini bow-shaped radar echo produced a locally intense downburst near Lake Alan Henry in southeastern Garza County. Winds estimated to exceed 90 MPH destroyed a number of mobile homes and vehicles near the lake, and injured one resident.Total economical losses sustained over the South Plains region during the outbreak were estimated to just under $1 million.",A second brief tornado was observed by storm spotters in rural areas northwest of Brownfield. No damage was reported.,PDS
200604,21,515,200604,21,518,1208919,5502156,TEXAS,48,2006,April,Tornado,C,157,FORT BEND,HGX,4/21/2006 5:15,CST,4/21/2006 5:18,0,0,0,0,50K,,NWS STORM SURVEY,,,,,F1,1,30,,,,,,,PLEAK,,,PLEAK,29.48333,-95.81667,29.48333,-95.81667,,Tornado snapped trees off and significantly damaged Meyer Elementary School in Pleak.,PDS
200604,6,2055,200604,6,2056,1209392,5502394,ARKANSAS,5,2006,April,Tornado,C,101,NEWTON,LZK,4/6/2006 20:55,CST,4/6/2006 20:56,0,0,0,0,,,NWS STORM SURVEY,,,,,F0,1.7,50,,,,,3,SW,MARBLE FALLS,3,SW,MARBLE FALLS,36.05,-93.13333,36.06667,-93.11667,,A weak tornado touched down briefly southwest of Marble Falls.  The tornado was on the ground for about 1.7 miles before lifting.  The only damage noted along the path of the tornado were a few trees that were snapped off or uprooted.,PDS
200604,2,1615,200604,2,1617,1207799,5499252,ILLINOIS,17,2006,April,Tornado,C,117,MACOUPIN,LSX,4/2/2006 16:15,CST,4/2/2006 16:17,0,0,0,0,,,NWS STORM SURVEY,,,,,F0,2,30,,,,,,,PIASA,,,PIASA,39.11667,-90.11667,39.11667,-90.08333,,"In Piasa a tornado struck around 515 pm CDT and damaged the roof and siding of numerous homes, snapped several trees and wooden power poles, and took large branches out of trees.  Damage was intermittent along a path continuing two miles east of Piasa on Highway 16, where the tornado destroyed a barn near Beacon Road and collapsed a parking canopy at Shipman Elevator Company. A man approximately 1.5 miles north of this tornado witnessed sheet metal debris rotating in the air and dirt swirling on the ground. A woman driving on Highway 16 reported being pushed off the road by the tornado.  Total track length of this F0 tornado was 2 miles with a maximum width of 30 yards.",PDS
200604,2,1615,200604,2,1616,1207800,5499253,ILLINOIS,17,2006,April,Tornado,C,117,MACOUPIN,LSX,4/2/2006 16:15,CST,4/2/2006 16:16,0,0,0,0,,,NWS STORM SURVEY,,,,,F0,0.5,30,,,,,2,NE,PIASA,2,NE,PIASA,39.13333,-90.08333,39.15,-90.08333,,Two miles northeast of Piasa along Little Flock Road another tornado struck around 515 pm CDT and damaged farm buildings and a grain bin. It then destroyed a mobile home after lifting and carrying it approximately 20 yards. This tornado was rated F0 with a track length of one-half mile and track width of 30 yards.,PDS
200604,2,1635,200604,2,1636,1207801,5499254,ILLINOIS,17,2006,April,Tornado,C,117,MACOUPIN,LSX,4/2/2006 16:35,CST,4/2/2006 16:36,0,0,0,0,,,NWS STORM SURVEY,,,,,F0,0.1,20,,,,,2,N,GILLESPIE,2,N,GILLESPIE,39.16667,-89.83333,39.16667,-89.83333,,The line of thunderstorms that produced small tornadoes near Piasa produced a third tornado around 535 pm CDT. This tornado destroyed a mobile home two miles north of Gillespie on Highway 4 at Quarry Road.  This tornado was rated F0 with a path length of one-tenth of a mile and a width of 20 yards.,PDS
200604,2,1656,200604,2,1658,1207802,5499255,ILLINOIS,17,2006,April,Tornado,C,135,MONTGOMERY,LSX,4/2/2006 16:56,CST,4/2/2006 16:58,0,0,0,0,,,NWS STORM SURVEY,,,,,F1,1.7,100,,,,,5,E,FARMERSVILLE,5,E,FARMERSVILLE,39.43333,-89.56667,39.46667,-89.55,,A tornado formed east of Farmersville and moved east northeast for almost 2 miles in Montgomery County. The tornado then crossed into Christian County. Machine sheds and barns were heavily damaged at three. farms along the path.,PDS
200603,12,912,200603,12,915,1206348,5499082,MISSOURI,29,2006,March,Tornado,C,95,JACKSON,EAX,3/12/2006 9:12,CST,3/12/2006 9:15,0,0,0,0,1K,,GENERAL PUBLIC,,,,,F0,2,150,,,,,1,NW,SIBLEY,1,NW,SIBLEY,39.05,-94.51667,39.05,-94.51667,,Tornado touched down 1 mile northwest of Sibley in rural areas at 0915 CST...with damage to trees and power lines noted. The tornado crossed into Ray county at 0915 CST...2 miles north northeast of Sibley.,PDS
200604,2,1649,200604,2,1653,1208072,5499678,ILLINOIS,17,2006,April,Tornado,C,167,SANGAMON,ILX,4/2/2006 16:49,CST,4/2/2006 16:53,0,0,0,0,,,NWS STORM SURVEY,,,,,F1,2,100,,,,,,,BERLIN,,,BERLIN,39.75,-89.9,39.76667,-89.88333,,"The tornado completely destroyed a grain bin and a pole barn, with numerous 12 to 18 inch diameter trees splintered off at various heights.  Near the end of the tornado track, a pole barn had its main door blown in, and half of the roof completely destroyed.",PDS
200604,2,1656,200604,2,1659,1208072,5499679,ILLINOIS,17,2006,April,Tornado,C,167,SANGAMON,ILX,4/2/2006 16:56,CST,4/2/2006 16:59,0,0,0,0,,,NWS STORM SURVEY,,,,,F1,1,100,,,,,2,N,CHATHAM,2,N,CHATHAM,39.7,-89.7,39.7,-89.66667,,The tornado removed roofing material from several new construction homes.,PDS
200604,2,1658,200604,2,1701,1208072,5499680,ILLINOIS,17,2006,April,Tornado,C,167,SANGAMON,ILX,4/2/2006 16:58,CST,4/2/2006 17:01,0,0,0,0,,,NWS STORM SURVEY,,,,,F1,1,100,,,,,,,SPRINGFIELD,,,SPRINGFIELD,39.8,-89.65,39.8,-89.65,,The tornado caused minor roof and structural damage to several businesses on the southwest side of Springfield.,PDS
200604,2,1659,200604,2,1700,1208072,5499681,ILLINOIS,17,2006,April,Tornado,C,167,SANGAMON,ILX,4/2/2006 16:59,CST,4/2/2006 17:00,0,0,0,0,,,NWS STORM SURVEY,,,,,F0,1.3,50,,,,,2,SW,PAWNEE,2,SW,PAWNEE,39.56667,-89.61667,39.58333,-89.58333,,The tornado destroyed 3 grain bins and blew them a quarter mile away.  It also damaged 3 barns and blew down a number of trees.,PDS
200604,2,1658,200604,2,1659,1208072,5499683,ILLINOIS,17,2006,April,Tornado,C,21,CHRISTIAN,ILX,4/2/2006 16:58,CST,4/2/2006 16:59,0,0,0,0,,,NWS STORM SURVEY,,,,,F0,0.5,30,,,,,5,NW,MORRISONVILLE,5,NW,MORRISONVILLE,39.46667,-89.53333,39.46667,-89.53333,,"Continued from Montgomery county, WFO St Louis forecast area.  Tornado briefly crossed a field in Christian county and no damage was reported.",PDS
200604,2,1708,200604,2,1716,1208073,5499684,ILLINOIS,17,2006,April,Tornado,C,21,CHRISTIAN,ILX,4/2/2006 17:08,CST,4/2/2006 17:16,1,0,0,0,,,NWS STORM SURVEY,,,,,F1,6.3,300,,,,,6,WSW,TAYLORVILLE,6,WSW,TAYLORVILLE,39.51667,-89.4,39.56667,-89.3,,The tornado damaged sheds and downed numerous trees along its path.  Several homes and businesses in Taylorville reported roof and structural damage.  There was one injury (direct) due to falling debris.,PDS
200604,7,2124,200604,7,2125,1208177,5499685,ALABAMA,1,2006,April,Tornado,C,83,LIMESTONE,HUN,4/7/2006 21:24,CST,4/7/2006 21:25,0,0,0,0,,,EMERGENCY MANAGER,,,,,F0,0.1,40,,,,,,,GREENBRIER,,,GREENBRIER,34.23333,-86.76667,34.23333,-86.76667,,A tornado briefly touched down along Interstate 565 and damaged a small sign and two trees along the interstate before quickly dissipating.,PDS
200604,7,2135,200604,7,2140,1208177,5499686,ALABAMA,1,2006,April,Tornado,C,79,LAWRENCE,HUN,4/7/2006 21:35,CST,4/7/2006 21:40,0,0,0,0,25K,,EMERGENCY MANAGER,,,,,F1,3,100,,,,,3,SE,SPEAKE,3,SE,SPEAKE,34.4,-85.65,34.4,-85.65,,A tornado touched down and demolished a large barn and uprooted several trees near highway 157 in a continuous path toward the Morgan county line.,PDS
200604,7,2141,200604,7,2148,1208177,5499687,ALABAMA,1,2006,April,Tornado,C,103,MORGAN,HUN,4/7/2006 21:41,CST,4/7/2006 21:48,0,0,0,0,80K,,EMERGENCY MANAGER,,,,,F1,6,150,,,,,3,SW,DANVILLE,3,SW,DANVILLE,34.75,-87.96667,34.75,-87.96667,,"The tornado that touched down in southeast Lawrence county continued its track into southwest Morgan county and moved east through Danville, Alabama. The tornado produced light to moderate roof damage to the Danville high school gymnasium roof, roofs of the press boxes at the Danville high school football field and further damage to the back stop and outfield walls at the Danville high school baseball field. The tornado further uprooted several trees and produced minor roof and awning damage to six homes in Danville. The tornado further moved northeast and slightly damaged the roofs of four homes and destroyed a barn along Craze road, about two miles northeast of Danville, Alabama.",PDS
200604,7,1718,200604,7,1719,1208178,5499692,TENNESSEE,47,2006,April,Tornado,C,127,MOORE,HUN,4/7/2006 17:18,CST,4/7/2006 17:19,0,0,0,0,,,LAW ENFORCEMENT,,,,,F0,0.1,30,,,,,7,W,LYNCHBURG,7,W,LYNCHBURG,35.28333,-86.5,35.28333,-86.5,,"The short lived F0 tornado that touched down along the Lincoln and Moore county line, further moved a short distance into Moore county before dissipating. The tornado uprooted two trees before dissipating along Chestnut ridge along highway 129.",PDS
200605,5,1630,200605,5,1632,1210329,5505205,TEXAS,48,2006,May,Tornado,C,305,LYNN,LUB,5/5/2006 16:30,CST,5/5/2006 16:32,0,0,0,0,0,0,GENERAL PUBLIC,,,,,F0,0.7,70,,,,,4,WNW,NEW HOME,4,WNW,NEW HOME,33.33333,-101.98333,33.33333,-101.96667,"May 5 Severe Thunderstorm Event Summary...Another outbreak of severe thunderstorms affected parts of the west Texas South Plains region during the afternoon and evening hours of the 5th.  This activity was part of a widespread severe weather event across much of west Texas, including the Permian Basin where at least one significant tornado occurred. Severe convection erupted during the late afternoon hours along a warm front that was oriented west-to-east over the southern portions of the South Plains. These storms quickly evolved into supercells, and produced large hail, damaging winds, and at least four tornadoes. Although the tornadoes remained over open farmland, tornadic winds destroyed to center-pivot irrigation systems northwest of Brownfield (Terry County). This resulted in property losses of half a million dollars.The supercellular convection evolved into a cluster of severe multicell storms by early evening as it continued to propagate eastward along the boundary. A small linear complex characterized by a mini bow-shaped radar echo produced a locally intense downburst near Lake Alan Henry in southeastern Garza County. Winds estimated to exceed 90 MPH destroyed a number of mobile homes and vehicles near the lake, and injured one resident.Total economical losses sustained over the South Plains region during the outbreak were estimated to just under $1 million.","The public observed a tornado near the intersection of Farm to Market Roads 179 and 211 around 16:30 CST. The tornado, which developed beneath a rapidly intensifying supercell thunderstorm, remained over open farmland and no damage was reported.",PDS
200604,8,302,200604,8,315,1209256,5501912,GEORGIA,13,2006,April,Tornado,C,121,FULTON,FFC,4/8/2006 3:02,EST,4/8/2006 3:15,0,0,0,0,1.5M,,NWS STORM SURVEY,,,,,F1,11,200,,,,,1,S,MOUNTAIN PARK,1,S,MOUNTAIN PARK,34.4,-85.03333,34.56667,-84.7,,"A storm survey conducted by the National Weather Service in Peachtree City, GA determined that the F1 tornado that began near Noonday in Cobb county continued eastward marking out a path approximately 11-miles long across North Fulton county.  Considerable damage was noted just south of Crabapple where a car wash and detail shop was destroyed, a gas station suffered major damage, and a nearby strip mall suffered minor damage.  Hundreds of trees were blown down along Rucker Road.  The damage continued eastward into the Alpharetta area where 40 homes were damaged by downed trees, five of which sustained major damage.  A dental building in Alpharetta also suffered major damage when a downed tree caused damage to the sprinkler system, flooding the building with thousands of gallons of water causing major damage to the historic building.  All-in-all, local newspapers reported that 149 homes in Fulton county sustained moderate to serious damage, some of which were a total loss.  Within Fulton county, the tornado had a path length of 11 miles with a path width ranging from 10 to 200 yards.  The entire path length of this tornado, including Cobb and Fulton counties, was 18-miles long.",PDS
200604,7,1643,200604,7,1645,1208029,5499465,MISSISSIPPI,28,2006,April,Tornado,C,53,HUMPHREYS,JAN,4/7/2006 16:43,CST,4/7/2006 16:45,0,0,0,0,,,LAW ENFORCEMENT,,,,,F0,1,30,,,,,4,NE,ISOLA,4,NE,ISOLA,33.3,-90.55,33.31667,-90.53333,"A swath of large hail, some wind damage and one brief tornado occurred from the third supercell thunderstorm to effect this region. This third storm moved along the exact path of supercell one but caused more damage and was more intense. This storm produced a swath of quarter to hen egg sized hail which damaged homes, broke windows and damaged vehicles. The core of this storm moved from the southwest corner of Sunflower County to the Inverness area, crossed the extreme northern tip of Humphreys County, and then moved into Leflore County between Moorhead and Morgan City.","This tornado was observed by a deputy from the Humphreys' County Sheriff Office briefly touching down in an open field northeast of Isola. Due to the rural area, no damage was found.",PDS
